Name,Price,Link,Description,SKU,Category,Tags,Stock
Bulbasaur,£63.00,https://scrapeme.live/shop/Bulbasaur/,"
Bulbasaur can be seen napping in bright sunlight. There is a seed on its back. By soaking up the sun’s rays, the seed grows progressively larger.
",4391,"Categories: Pokemon, Seed","Tags: bulbasaur, Overgrow, Seed",45 in stock
Ivysaur,£87.00,https://scrapeme.live/shop/Ivysaur/,"
There is a bud on this Pokémon’s back. To support its weight, Ivysaur’s legs and trunk grow thick and strong. If it starts spending more time lying in the sunlight, it’s a sign that the bud will bloom into a large flower soon.
",7227,"Categories: Pokemon, Seed","Tags: ivysaur, Overgrow, Seed",142 in stock
Venusaur,£105.00,https://scrapeme.live/shop/Venusaur/,"
There is a large flower on Venusaur’s back. The flower is said to take on vivid colors if it gets plenty of nutrition and sunlight. The flower’s aroma soothes the emotions of people.
",7036,"Categories: Pokemon, Seed","Tags: Overgrow, Seed, venusaur",30 in stock
Charmander,£48.00,https://scrapeme.live/shop/Charmander/,"
The flame that burns at the tip of its tail is an indication of its emotions. The flame wavers when Charmander is enjoying itself. If the Pokémon becomes enraged, the flame burns fiercely.
",9086,"Categories: Lizard, Pokemon","Tags: Blaze, charmander, Lizard",206 in stock
Charmeleon,£165.00,https://scrapeme.live/shop/Charmeleon/,"
Charmeleon mercilessly destroys its foes using its sharp claws. If it encounters a strong foe, it turns aggressive. In this excited state, the flame at the tip of its tail flares with a bluish white color.
",6565,"Categories: Flame, Pokemon","Tags: Blaze, charmeleon, Flame",284 in stock
Charizard,£156.00,https://scrapeme.live/shop/Charizard/,"
Charizard flies around the sky in search of powerful opponents. It breathes fire of such great heat that it melts anything. However, it never turns its fiery breath on any opponent weaker than itself.
",8840,"Categories: Flame, Pokemon","Tags: Blaze, Charizard, Flame",31 in stock
Squirtle,£130.00,https://scrapeme.live/shop/Squirtle/,"
Squirtle’s shell is not merely used for protection. The shell’s rounded shape and the grooves on its surface help minimize resistance in water, enabling this Pokémon to swim at high speeds.
",6094,"Categories: Pokemon, Tiny Turtle","Tags: squirtle, Tiny Turtle, Torrent",178 in stock
Wartortle,£123.00,https://scrapeme.live/shop/Wartortle/,"
Its tail is large and covered with a rich, thick fur. The tail becomes increasingly deeper in color as Wartortle ages. The scratches on its shell are evidence of this Pokémon’s toughness as a battler.
",9659,"Categories: Pokemon, Turtle","Tags: Torrent, Turtle, wartortle",24 in stock
Blastoise,£76.00,https://scrapeme.live/shop/Blastoise/,"
Blastoise has water spouts that protrude from its shell. The water spouts are very accurate. They can shoot bullets of water with enough accuracy to strike empty cans from a distance of over 160 feet.
",5212,"Categories: Pokemon, Shellfish","Tags: blastoise, Shellfish, Torrent",88 in stock
Caterpie,£73.00,https://scrapeme.live/shop/Caterpie/,"
Caterpie has a voracious appetite. It can devour leaves bigger than its body right before your eyes. From its antenna, this Pokémon releases a terrifically strong odor.
",7492,"Categories: Pokemon, Worm","Tags: caterpie, Shield Dust, Worm",40 in stock
Metapod,£148.00,https://scrapeme.live/shop/Metapod/,"
The shell covering this Pokémon’s body is as hard as an iron slab. Metapod does not move very much. It stays still because it is preparing its soft innards for evolution inside the hard shell.
",2072,"Categories: Cocoon, Pokemon","Tags: Cocoon, metapod, Shed Skin",285 in stock
Butterfree,£162.00,https://scrapeme.live/shop/Butterfree/,"
Butterfree has a superior ability to search for delicious honey from flowers. It can even search out, extract, and carry honey from flowers that are blooming over six miles from its nest.
",9507,"Categories: Butterfly, Pokemon","Tags: Butterfly, butterfree, Compound Eyes",242 in stock
Weedle,£25.00,https://scrapeme.live/shop/Weedle/,"
Weedle has an extremely acute sense of smell. It is capable of distinguishing its favorite kinds of leaves from those it dislikes just by sniffing with its big red proboscis (nose).
",7525,"Categories: Hairy Bug, Pokemon","Tags: Hairy Bug, Shield Dust, weedle",65 in stock
Kakuna,£148.00,https://scrapeme.live/shop/Kakuna/,"
Kakuna remains virtually immobile as it clings to a tree. However, on the inside, it is extremely busy as it prepares for its coming evolution. This is evident from how hot the shell becomes to the touch.
",1049,"Categories: Cocoon, Pokemon","Tags: Cocoon, kakuna, Shed Skin",260 in stock
Beedrill,£168.00,https://scrapeme.live/shop/Beedrill/,"
Beedrill is extremely territorial. No one should ever approach its nest—this is for their own safety. If angered, they will attack in a furious swarm.
",6542,"Categories: Poison Bee, Pokemon","Tags: beedrill, Poison Bee, Swarm",125 in stock
Pidgey,£159.00,https://scrapeme.live/shop/Pidgey/,"
Pidgey has an extremely sharp sense of direction. It is capable of unerringly returning home to its nest, however far it may be removed from its familiar surroundings.
",9452,"Categories: Pokemon, Tiny Bird","Tags: Keen Eye, pidgey, Tiny Bird",175 in stock
Pidgeotto,£84.00,https://scrapeme.live/shop/Pidgeotto/,"
Pidgeotto claims a large area as its own territory. This Pokémon flies around, patrolling its living space. If its territory is violated, it shows no mercy in thoroughly punishing the foe with its sharp claws.
",1150,"Categories: Bird, Pokemon","Tags: Bird, Keen Eye, pidgeotto",120 in stock
Pidgeot,£185.00,https://scrapeme.live/shop/Pidgeot/,"
This Pokémon has a dazzling plumage of beautifully glossy feathers. Many Trainers are captivated by the striking beauty of the feathers on its head, compelling them to choose Pidgeot as their Pokémon.
",8462,"Categories: Bird, Pokemon","Tags: Bird, Keen Eye, pidgeot",90 in stock
Rattata,£128.00,https://scrapeme.live/shop/Rattata/,"
Rattata is cautious in the extreme. Even while it is asleep, it constantly listens by moving its ears around. It is not picky about where it lives—it will make its nest anywhere.
",1009,"Categories: Mouse, Pokemon","Tags: Mouse, rattata, Run Away",16 in stock
Raticate,£60.00,https://scrapeme.live/shop/Raticate/,"
Raticate’s sturdy fangs grow steadily. To keep them ground down, it gnaws on rocks and logs. It may even chew on the walls of houses.
",5745,"Categories: Mouse, Pokemon","Tags: Mouse, raticate, Run Away",204 in stock
Spearow,£133.00,https://scrapeme.live/shop/Spearow/,"
Spearow has a very loud cry that can be heard over half a mile away. If its high, keening cry is heard echoing all around, it is a sign that they are warning each other of danger.
",1591,"Categories: Pokemon, Tiny Bird","Tags: Keen Eye, spearow, Tiny Bird",46 in stock
Fearow,£95.00,https://scrapeme.live/shop/Fearow/,"
Fearow is recognized by its long neck and elongated beak. They are conveniently shaped for catching prey in soil or water. It deftly moves its long and skinny beak to pluck prey.
",9127,"Categories: Beak, Pokemon","Tags: Beak, fearow, Keen Eye",276 in stock
Ekans,£55.00,https://scrapeme.live/shop/Ekans/,"
Ekans curls itself up in a spiral while it rests. Assuming this position allows it to quickly respond to a threat from any direction with a glare from its upraised head.
",5690,"Categories: Pokemon, Snake","Tags: ekans, Shed Skin, Snake",120 in stock
Arbok,£182.00,https://scrapeme.live/shop/Arbok/,"
This Pokémon is terrifically strong in order to constrict things with its body. It can even flatten steel oil drums. Once Arbok wraps its body around its foe, escaping its crunching embrace is impossible.
",9230,"Categories: Cobra, Pokemon","Tags: arbok, Cobra, Shed Skin",248 in stock
Pikachu,£37.00,https://scrapeme.live/shop/Pikachu/,"
This Pokémon has electricity-storing pouches on its cheeks. These appear to become electrically charged during the night while Pikachu sleeps. It occasionally discharges electricity when it is dozy after waking up.
",1333,"Categories: Mouse, Pokemon","Tags: Mouse, pikachu, Static",254 in stock
Raichu,£140.00,https://scrapeme.live/shop/Raichu/,"
This Pokémon exudes a weak electrical charge from all over its body that makes it take on a slight glow in darkness. Raichu plants its tail in the ground to discharge electricity.
",3488,"Categories: Mouse, Pokemon","Tags: Mouse, raichu, Static",215 in stock
Sandshrew,£82.00,https://scrapeme.live/shop/Sandshrew/,"
Sandshrew has a very dry hide that is extremely tough. The Pokémon can roll into a ball that repels any attack. At night, it burrows into the desert sand to sleep.
",9134,"Categories: Mouse, Pokemon","Tags: Mouse, Sand Veil, sandshrew",100 in stock
Sandslash,£155.00,https://scrapeme.live/shop/Sandslash/,"
Sandslash can roll up its body as if it were a ball covered with large spikes. In battle, this Pokémon will try to make the foe flinch by jabbing it with its spines. It then leaps at the stunned foe to tear wildly with its sharp claws.
",4747,"Categories: Mouse, Pokemon","Tags: Mouse, Sand Veil, sandslash",236 in stock
Nidorina,£28.00,https://scrapeme.live/shop/Nidorina/,"
When Nidorina are with their friends or family, they keep their barbs tucked away to prevent hurting each other. This Pokémon appears to become nervous if separated from the others.
",9779,"Categories: Poison Pin, Pokemon","Tags: nidorina, Poison Pin, Poison Point",58 in stock
Nidoqueen,£106.00,https://scrapeme.live/shop/Nidoqueen/,"
Nidoqueen’s body is encased in extremely hard scales. It is adept at sending foes flying with harsh tackles. This Pokémon is at its strongest when it is defending its young.
",6614,"Categories: Drill, Pokemon","Tags: Drill, nidoqueen, Poison Point",153 in stock
Nidorino,£179.00,https://scrapeme.live/shop/Nidorino/,"
Nidorino has a horn that is harder than a diamond. If it senses a hostile presence, all the barbs on its back bristle up at once, and it challenges the foe with all its might.
",9646,"Categories: Poison Pin, Pokemon","Tags: nidorino, Poison Pin, Poison Point",279 in stock
Nidoking,£31.00,https://scrapeme.live/shop/Nidoking/,"
Nidoking’s thick tail packs enormously destructive power. With one swing, it can topple a metal transmission tower. Once this Pokémon goes on a rampage, there is no stopping it.
",1159,"Categories: Drill, Pokemon","Tags: Drill, nidoking, Poison Point",178 in stock
Clefairy,£160.00,https://scrapeme.live/shop/Clefairy/,"
On every night of a full moon, groups of this Pokémon come out to play. When dawn arrives, the tired Clefairy return to their quiet mountain retreats and go to sleep nestled up against each other.
",3259,"Categories: Fairy, Pokemon","Tags: clefairy, Cute Charm, Fairy",86 in stock
Clefable,£188.00,https://scrapeme.live/shop/Clefable/,"
Clefable moves by skipping lightly as if it were flying using its wings. Its bouncy step lets it even walk on water. It is known to take strolls on lakes on quiet, moonlit nights.
",9786,"Categories: Fairy, Pokemon","Tags: clefable, Cute Charm, Fairy",23 in stock
Vulpix,£85.00,https://scrapeme.live/shop/Vulpix/,"
Inside Vulpix’s body burns a flame that never goes out. During the daytime, when the temperatures rise, this Pokémon releases flames from its mouth to prevent its body from growing too hot.
",1440,"Categories: Fox, Pokemon","Tags: Flash Fire, Fox, vulpix",268 in stock
Ninetales,£52.00,https://scrapeme.live/shop/Ninetales/,"
Legend has it that Ninetales came into being when nine wizards possessing sacred powers merged into one. This Pokémon is highly intelligent—it can understand human speech.
",5173,"Categories: Fox, Pokemon","Tags: Flash Fire, Fox, ninetales",215 in stock
Jigglypuff,£61.00,https://scrapeme.live/shop/Jigglypuff/,"
When this Pokémon sings, it never pauses to breathe. If it is in a battle against an opponent that does not easily fall asleep, Jigglypuff cannot breathe, endangering its life.
",9180,"Categories: Balloon, Pokemon","Tags: Balloon, Cute Charm, jigglypuff",136 in stock
Wigglytuff,£130.00,https://scrapeme.live/shop/Wigglytuff/,"
Wigglytuff’s body is very flexible. By inhaling deeply, this Pokémon can inflate itself seemingly without end. Once inflated, Wigglytuff bounces along lightly like a balloon.
",2733,"Categories: Balloon, Pokemon","Tags: Balloon, Cute Charm, wigglytuff",260 in stock
Zubat,£125.00,https://scrapeme.live/shop/Zubat/,"
Zubat avoids sunlight because exposure causes it to become unhealthy. During the daytime, it stays in caves or under the eaves of old houses, sleeping while hanging upside down.
",2584,"Categories: Bat, Pokemon","Tags: Bat, Inner Focus, zubat",154 in stock
Golbat,£136.00,https://scrapeme.live/shop/Golbat/,"
Golbat bites down on prey with its four fangs and drinks the victim’s blood. It becomes active on inky dark moonless nights, flying around to attack people and Pokémon.
",5941,"Categories: Bat, Pokemon","Tags: Bat, golbat, Inner Focus",52 in stock
Oddish,£45.00,https://scrapeme.live/shop/Oddish/,"
Oddish searches for fertile, nutrient-rich soil, then plants itself. During the daytime, while it is planted, this Pokémon’s feet are thought to change shape and become similar to the roots of trees.
",8337,"Categories: Pokemon, Weed","Tags: Chlorophyll, oddish, Weed",296 in stock
Gloom,£178.00,https://scrapeme.live/shop/Gloom/,"
From its mouth Gloom drips honey that smells absolutely horrible. Apparently, it loves the horrid stench. It sniffs the noxious fumes and then drools even more of its honey.
",7374,"Categories: Pokemon, Weed","Tags: Chlorophyll, gloom, Weed",74 in stock
Vileplume,£170.00,https://scrapeme.live/shop/Vileplume/,"
Vileplume has the world’s largest petals. They are used to attract prey that are then doused with toxic spores. Once the prey are immobilized, this Pokémon catches and devours them.
",5295,"Categories: Flower, Pokemon","Tags: Chlorophyll, Flower, vileplume",283 in stock
Paras,£168.00,https://scrapeme.live/shop/Paras/,"
Paras has parasitic mushrooms growing on its back called tochukaso. They grow large by drawing nutrients from this Bug Pokémon host. They are highly valued as a medicine for extending life.
",9691,"Categories: Mushroom, Pokemon","Tags: Effect Spore, Mushroom, paras",192 in stock
Parasect,£27.00,https://scrapeme.live/shop/Parasect/,"
Parasect is known to infest large trees en masse and drain nutrients from the lower trunk and roots. When an infested tree dies, they move onto another tree all at once.
",4612,"Categories: Mushroom, Pokemon","Tags: Effect Spore, Mushroom, parasect",17 in stock
Venonat,£158.00,https://scrapeme.live/shop/Venonat/,"
Venonat is said to have evolved with a coat of thin, stiff hair that covers its entire body for protection. It possesses large eyes that never fail to spot even minuscule prey.
",1329,"Categories: Insect, Pokemon","Tags: Compound Eyes, Insect, venonat",177 in stock
Venomoth,£53.00,https://scrapeme.live/shop/Venomoth/,"
Venomoth is nocturnal—it is a Pokémon that only becomes active at night. Its favorite prey are small insects that gather around streetlights, attracted by the light in the darkness.
",3503,"Categories: Poison Moth, Pokemon","Tags: Poison Moth, Shield Dust, venomoth",22 in stock
Diglett,£122.00,https://scrapeme.live/shop/Diglett/,"
Diglett are raised in most farms. The reason is simple— wherever this Pokémon burrows, the soil is left perfectly tilled for planting crops. This soil is made ideal for growing delicious vegetables.
",4383,"Categories: Mole, Pokemon","Tags: diglett, Mole, Sand Veil",227 in stock
Dugtrio,£111.00,https://scrapeme.live/shop/Dugtrio/,"
Dugtrio are actually triplets that emerged from one body. As a result, each triplet thinks exactly like the other two triplets. They work cooperatively to burrow endlessly.
",7897,"Categories: Mole, Pokemon","Tags: dugtrio, Mole, Sand Veil",290 in stock
Meowth,£131.00,https://scrapeme.live/shop/Meowth/,"
Meowth withdraws its sharp claws into its paws to slinkily sneak about without making any incriminating footsteps. For some reason, this Pokémon loves shiny coins that glitter with light.
",9594,"Categories: Pokemon, Scratch Cat","Tags: meowth, Pickup, Scratch Cat",203 in stock
Persian,£200.00,https://scrapeme.live/shop/Persian/,"
Persian has six bold whiskers that give it a look of toughness. The whiskers sense air movements to determine what is in the Pokémon’s surrounding vicinity. It becomes docile if grabbed by the whiskers.
",3752,"Categories: Classy Cat, Pokemon","Tags: Classy Cat, persian, Technician",108 in stock
Psyduck,£182.00,https://scrapeme.live/shop/Psyduck/,"
If it uses its mysterious power, Psyduck can’t remember having done so. It apparently can’t form a memory of such an event because it goes into an altered state that is much like deep sleep.
",6470,"Categories: Duck, Pokemon","Tags: Damp, Duck, psyduck",214 in stock
Golduck,£31.00,https://scrapeme.live/shop/Golduck/,"
Golduck is the fastest swimmer among all Pokémon. It swims effortlessly, even in a rough, stormy sea. It sometimes rescues people from wrecked ships floundering in high seas.
",8764,"Categories: Duck, Pokemon","Tags: Damp, Duck, golduck",278 in stock
Mankey,£125.00,https://scrapeme.live/shop/Mankey/,"
When Mankey starts shaking and its nasal breathing turns rough, it’s a sure sign that it is becoming angry. However, because it goes into a towering rage almost instantly, it is impossible for anyone to flee its wrath.
",5180,"Categories: Pig Monkey, Pokemon","Tags: mankey, Pig Monkey, Vital Spirit",209 in stock
Primeape,£86.00,https://scrapeme.live/shop/Primeape/,"
When Primeape becomes furious, its blood circulation is boosted. In turn, its muscles are made even stronger. However, it also becomes much less intelligent at the same time.
",3052,"Categories: Pig Monkey, Pokemon","Tags: Pig Monkey, primeape, Vital Spirit",68 in stock
Growlithe,£30.00,https://scrapeme.live/shop/Growlithe/,"
Growlithe has a superb sense of smell. Once it smells anything, this Pokémon won’t forget the scent, no matter what. It uses its advanced olfactory sense to determine the emotions of other living things.
",1749,"Categories: Pokemon, Puppy","Tags: growlithe, Intimidate, Puppy",243 in stock
Arcanine,£69.00,https://scrapeme.live/shop/Arcanine/,"
Arcanine is known for its high speed. It is said to be capable of running over 6,200 miles in a single day and night. The fire that blazes wildly within this Pokémon’s body is its source of power.
",9267,"Categories: Legendary, Pokemon","Tags: arcanine, Intimidate, Legendary",14 in stock
Poliwag,£174.00,https://scrapeme.live/shop/Poliwag/,"
Poliwag has a very thin skin. It is possible to see the Pokémon’s spiral innards right through the skin. Despite its thinness, however, the skin is also very flexible. Even sharp fangs bounce right off it.
",6402,"Categories: Pokemon, Tadpole","Tags: Damp, poliwag, Tadpole",217 in stock
Poliwhirl,£121.00,https://scrapeme.live/shop/Poliwhirl/,"
The surface of Poliwhirl’s body is always wet and slick with a slimy fluid. Because of this slippery covering, it can easily slip and slide out of the clutches of any enemy in battle.
",4447,"Categories: Pokemon, Tadpole","Tags: Damp, poliwhirl, Tadpole",139 in stock
Poliwrath,£152.00,https://scrapeme.live/shop/Poliwrath/,"
Poliwrath’s highly developed, brawny muscles never grow fatigued, however much it exercises. It is so tirelessly strong, this Pokémon can swim back and forth across the ocean without effort.
",1848,"Categories: Pokemon, Tadpole","Tags: Damp, poliwrath, Tadpole",216 in stock
Abra,£141.00,https://scrapeme.live/shop/Abra/,"
Abra needs to sleep for eighteen hours a day. If it doesn’t, this Pokémon loses its ability to use telekinetic powers. If it is attacked, Abra escapes using Teleport while it is still sleeping.
",3845,"Categories: Pokemon, Psi","Tags: abra, Inner Focus, Psi",116 in stock
Kadabra,£129.00,https://scrapeme.live/shop/Kadabra/,"
Kadabra holds a silver spoon in its hand. The spoon is used to amplify the alpha waves in its brain. Without the spoon, the Pokémon is said to be limited to half the usual amount of its telekinetic powers.
",9040,"Categories: Pokemon, Psi","Tags: Inner Focus, kadabra, Psi",195 in stock
Alakazam,£40.00,https://scrapeme.live/shop/Alakazam/,"
Alakazam’s brain continually grows, infinitely multiplying brain cells. This amazing brain gives this Pokémon an astoundingly high IQ of 5,000. It has a thorough memory of everything that has occurred in the world.
",7975,"Categories: Pokemon, Psi","Tags: alakazam, Inner Focus, Psi",142 in stock
Machop,£166.00,https://scrapeme.live/shop/Machop/,"
Machop exercises by hefting around a Graveler as if it were a barbell. There are some Machop that travel the world in a quest to master all kinds of martial arts.
",9506,"Categories: Pokemon, Superpower","Tags: Guts, machop, Superpower",173 in stock
Machoke,£27.00,https://scrapeme.live/shop/Machoke/,"
Machoke undertakes bodybuilding every day even as it helps people with tough, physically demanding labor. On its days off, this Pokémon heads to the fields and mountains to exercise and train.
",9503,"Categories: Pokemon, Superpower","Tags: Guts, machoke, Superpower",10 in stock
Machamp,£121.00,https://scrapeme.live/shop/Machamp/,"
Machamp is known as the Pokémon that has mastered every kind of martial arts. If it grabs hold of the foe with its four arms, the battle is all but over. The hapless foe is thrown far over the horizon.
",2857,"Categories: Pokemon, Superpower","Tags: Guts, machamp, Superpower",242 in stock
Bellsprout,£74.00,https://scrapeme.live/shop/Bellsprout/,"
Bellsprout’s thin and flexible body lets it bend and sway to avoid any attack, however strong it may be. From its mouth, this Pokémon spits a corrosive fluid that melts even iron.
",7454,"Categories: Flower, Pokemon","Tags: bellsprout, Chlorophyll, Flower",257 in stock
Weepinbell,£26.00,https://scrapeme.live/shop/Weepinbell/,"
Weepinbell has a large hook on its rear end. At night, the Pokémon hooks on to a tree branch and goes to sleep. If it moves around in its sleep, it may wake up to find itself on the ground.
",5253,"Categories: Flycatcher, Pokemon","Tags: Chlorophyll, Flycatcher, weepinbell",46 in stock
Victreebel,£68.00,https://scrapeme.live/shop/Victreebel/,"
Victreebel has a long vine that extends from its head. This vine is waved and flicked about as if it were an animal to attract prey. When an unsuspecting prey draws near, this Pokémon swallows it whole.
",2187,"Categories: Flycatcher, Pokemon","Tags: Chlorophyll, Flycatcher, victreebel",119 in stock
Tentacool,£186.00,https://scrapeme.live/shop/Tentacool/,"
Tentacool absorbs sunlight and refracts it using water inside its body to convert it into beam energy. This Pokémon shoots beams from the small round organ above its eyes.
",1506,"Categories: Jellyfish, Pokemon","Tags: Clear Body, Jellyfish, tentacool",66 in stock
Tentacruel,£65.00,https://scrapeme.live/shop/Tentacruel/,"
Tentacruel has tentacles that can be freely elongated and shortened at will. It ensnares prey with its tentacles and weakens the prey by dosing it with a harsh toxin. It can catch up to 80 prey at the same time.
",1723,"Categories: Jellyfish, Pokemon","Tags: Clear Body, Jellyfish, tentacruel",175 in stock
Geodude,£32.00,https://scrapeme.live/shop/Geodude/,"
When Geodude sleeps deeply, it buries itself halfway into the ground. It will not awaken even if hikers step on it unwittingly. In the morning, this Pokémon rolls downhill in search of food.
",1650,"Categories: Pokemon, Rock","Tags: geodude, Rock, Rock Head",77 in stock
Graveler,£182.00,https://scrapeme.live/shop/Graveler/,"
Rocks are Graveler’s favorite food. This Pokémon will climb a mountain from the base to the summit, crunchingly feasting on rocks all the while. Upon reaching the peak, it rolls back down to the bottom.
",4748,"Categories: Pokemon, Rock","Tags: graveler, Rock, Rock Head",86 in stock
Golem,£103.00,https://scrapeme.live/shop/Golem/,"
Golem is known for rolling down from mountains. To prevent them from rolling into the homes of people downhill, grooves have been dug into the sides of mountains to serve as guideways for diverting this Pokémon’s course.
",1408,"Categories: Megaton, Pokemon","Tags: golem, Megaton, Rock Head",151 in stock
Ponyta,£53.00,https://scrapeme.live/shop/Ponyta/,"
Ponyta is very weak at birth. It can barely stand up. This Pokémon becomes stronger by stumbling and falling to keep up with its parent.
",3629,"Categories: Fire Horse, Pokemon","Tags: Fire Horse, ponyta, Run Away",41 in stock
Rapidash,£98.00,https://scrapeme.live/shop/Rapidash/,"
Rapidash usually can be seen casually cantering in the fields and plains. However, when this Pokémon turns serious, its fiery manes flare and blaze as it gallops its way up to 150 mph.
",3414,"Categories: Fire Horse, Pokemon","Tags: Fire Horse, rapidash, Run Away",194 in stock
Slowpoke,£109.00,https://scrapeme.live/shop/Slowpoke/,"
Slowpoke uses its tail to catch prey by dipping it in water at the side of a river. However, this Pokémon often forgets what it’s doing and often spends entire days just loafing at water’s edge.
",2145,"Categories: Dopey, Pokemon","Tags: Dopey, Oblivious, slowpoke",57 in stock
Slowbro,£179.00,https://scrapeme.live/shop/Slowbro/,"
Slowbro’s tail has a Shellder firmly attached with a bite. As a result, the tail can’t be used for fishing anymore. This causes Slowbro to grudgingly swim and catch prey instead.
",3864,"Categories: Hermit Crab, Pokemon","Tags: Hermit Crab, Oblivious, slowbro",289 in stock
