Name,Price,Link,Description,SKU,Category,Tags,Stock
Croconaw,£175.00,https://scrapeme.live/shop/Croconaw/,"
Once Croconaw has clamped its jaws on its foe, it will absolutely not let go. Because the tips of its fangs are forked back like barbed fishhooks, they become impossible to remove when they have sunk in.
",9299,"Categories: Big Jaw, Pokemon","Tags: Big Jaw, croconaw, Torrent",255 in stock
Feraligatr,£183.00,https://scrapeme.live/shop/Feraligatr/,"
Feraligatr intimidates its foes by opening its huge mouth. In battle, it will kick the ground hard with its thick and powerful hind legs to charge at the foe at an incredible speed.
",9344,"Categories: Big Jaw, Pokemon","Tags: Big Jaw, feraligatr, Torrent",175 in stock
Sentret,£48.00,https://scrapeme.live/shop/Sentret/,"
When Sentret sleeps, it does so while another stands guard. The sentry wakes the others at the first sign of danger. When this Pokémon becomes separated from its pack, it becomes incapable of sleep due to fear.
",2687,"Categories: Pokemon, Scout","Tags: Keen Eye, Scout, sentret",83 in stock
Furret,£154.00,https://scrapeme.live/shop/Furret/,"
Furret has a very slim build. When under attack, it can slickly squirm through narrow spaces and get away. In spite of its short limbs, this Pokémon is very nimble and fleet.
",4876,"Categories: Long Body, Pokemon","Tags: furret, Keen Eye, Long Body",85 in stock
Hoothoot,£48.00,https://scrapeme.live/shop/Hoothoot/,"
Hoothoot has an internal organ that senses and tracks the earth’s rotation. Using this special organ, this Pokémon begins hooting at precisely the same time every day.
",4691,"Categories: Owl, Pokemon","Tags: hoothoot, Keen Eye, Owl",204 in stock
Noctowl,£170.00,https://scrapeme.live/shop/Noctowl/,"
Noctowl never fails at catching prey in darkness. This Pokémon owes its success to its superior vision that allows it to see in minimal light, and to its soft, supple wings that make no sound in flight.
",9939,"Categories: Owl, Pokemon","Tags: Keen Eye, noctowl, Owl",10 in stock
Ledyba,£98.00,https://scrapeme.live/shop/Ledyba/,"
Ledyba secretes an aromatic fluid from where its legs join its body. This fluid is used for communicating with others. This Pokémon conveys its feelings to others by altering the fluid’s scent.
",3874,"Categories: Five Star, Pokemon","Tags: Five Star, ledyba, Swarm",83 in stock
Ledian,£136.00,https://scrapeme.live/shop/Ledian/,"
It is said that in lands with clean air, where the stars fill the sky, there live Ledian in countless numbers. There is a good reason for this—the Pokémon uses the light of the stars as its energy.
",1806,"Categories: Five Star, Pokemon","Tags: Five Star, ledian, Swarm",65 in stock
Spinarak,£199.00,https://scrapeme.live/shop/Spinarak/,"
The web spun by Spinarak can be considered its second nervous system. It is said that this Pokémon can determine what kind of prey is touching its web just by the tiny vibrations it feels through the web’s strands.
",4388,"Categories: Pokemon, String Spit","Tags: spinarak, String Spit, Swarm",136 in stock
Ariados,£85.00,https://scrapeme.live/shop/Ariados/,"
Ariados’s feet are tipped with tiny hooked claws that enable it to scuttle on ceilings and vertical walls. This Pokémon constricts the foe with thin and strong silk webbing.
",9759,"Categories: Long Leg, Pokemon","Tags: ariados, Long Leg, Swarm",50 in stock
Crobat,£195.00,https://scrapeme.live/shop/Crobat/,"
Crobat sneaks up on its intended prey using wings that barely make a sound. This Pokémon rests by hanging on a tree branch with its rear legs that serve as wings.
",6120,"Categories: Bat, Pokemon","Tags: Bat, crobat, Inner Focus",245 in stock
Chinchou,£59.00,https://scrapeme.live/shop/Chinchou/,"
Chinchou’s two antennas are filled with cells that generate strong electricity. This Pokémon’s cells create so much electrical power, it even makes itself tingle slightly.
",2651,"Categories: Angler, Pokemon","Tags: Angler, chinchou, Illuminate",130 in stock
Lanturn,£131.00,https://scrapeme.live/shop/Lanturn/,"
Lanturn is known to emit light. If you peer down into the dark sea from a ship at night, you can sometimes see this Pokémon’s light rising from the depths where it swims. It gives the sea an appearance of a starlit night.
",7579,"Categories: Light, Pokemon","Tags: Illuminate, lanturn, Light",218 in stock
Pichu,£193.00,https://scrapeme.live/shop/Pichu/,"
When Pichu plays with others, it may short out electricity with another Pichu, creating a shower of sparks. In that event, this Pokémon will begin crying, startled by the flash of sparks.
",4987,"Categories: Pokemon, Tiny Mouse","Tags: pichu, Static, Tiny Mouse",64 in stock
Cleffa,£107.00,https://scrapeme.live/shop/Cleffa/,"
On nights with many shooting stars, Cleffa can be seen dancing in a ring. They dance through the night and stop only at the break of day, when these Pokémon quench their thirst with the morning dew.
",2794,"Categories: Pokemon, Star Shape","Tags: cleffa, Cute Charm, Star Shape",187 in stock
Igglybuff,£189.00,https://scrapeme.live/shop/Igglybuff/,"
Igglybuff has a soft and plushy body that feels very much like a marshmallow. From this body wafts a gently sweet fragrance that soothes and calms the emotions of its foes.
",2662,"Categories: Balloon, Pokemon","Tags: Balloon, Cute Charm, igglybuff",170 in stock
Togepi,£47.00,https://scrapeme.live/shop/Togepi/,"
As its energy, Togepi uses the positive emotions of compassion and pleasure exuded by people and Pokémon. This Pokémon stores up feelings of happiness inside its shell, then shares them with others.
",1684,"Categories: Pokemon, Spike Ball","Tags: Serene Grace, Spike Ball, togepi",264 in stock
Togetic,£69.00,https://scrapeme.live/shop/Togetic/,"
Togetic is said to be a Pokémon that brings good fortune. When the Pokémon spots someone who is pure of heart, it is said to appear and share its happiness with that person.
",9410,"Categories: Happiness, Pokemon","Tags: Happiness, Serene Grace, togetic",293 in stock
Natu,£99.00,https://scrapeme.live/shop/Natu/,"
Natu has a highly developed jumping ability. The Pokémon flaps and leaps onto tree branches that are taller than grown-up people to pick at the tree’s new shoots.
",2942,"Categories: Pokemon, Tiny Bird","Tags: natu, Synchronize, Tiny Bird",36 in stock
Xatu,£123.00,https://scrapeme.live/shop/Xatu/,"
Xatu is known to stand motionless while staring at the sun all day long. Some people revere it as a mystical Pokémon out of their belief that Xatu is in possession of the power to see into the future.
",7616,"Categories: Mystic, Pokemon","Tags: Mystic, Synchronize, xatu",196 in stock
Mareep,£79.00,https://scrapeme.live/shop/Mareep/,"
Mareep’s fluffy coat of wool rubs together and builds a static charge. The more static electricity is charged, the more brightly the lightbulb at the tip of its tail glows.
",2016,"Categories: Pokemon, Wool","Tags: mareep, Static, Wool",152 in stock
Flaaffy,£163.00,https://scrapeme.live/shop/Flaaffy/,"
Flaaffy’s wool quality changes so that it can generate a high amount of static electricity with a small amount of wool. The bare and slick parts of its hide are shielded against electricity.
",9291,"Categories: Pokemon, Wool","Tags: flaaffy, Static, Wool",64 in stock
Ampharos,£41.00,https://scrapeme.live/shop/Ampharos/,"
Ampharos gives off so much light that it can be seen even from space. People in the old days used the light of this Pokémon to send signals back and forth with others far away.
",2141,"Categories: Light, Pokemon","Tags: ampharos, Light, Static",247 in stock
Bellossom,£25.00,https://scrapeme.live/shop/Bellossom/,"
A Bellossom grows flowers more beautifully if it has evolved from a smelly Gloom—the more stinky the better. At night, this Pokémon closes its petals and goes to sleep.
",7003,"Categories: Flower, Pokemon","Tags: bellossom, Chlorophyll, Flower",234 in stock
Marill,£127.00,https://scrapeme.live/shop/Marill/,"
When fishing for food at the edge of a fast-running stream, Marill wraps its tail around the trunk of a tree. This Pokémon’s tail is flexible and configured to stretch.
",4728,"Categories: Aqua Mouse, Pokemon","Tags: Aqua Mouse, marill, Thick Fat",55 in stock
Azumarill,£175.00,https://scrapeme.live/shop/Azumarill/,"
Azumarill can make balloons out of air. It makes these air balloons if it spots a drowning Pokémon. The air balloons enable the Pokémon in trouble to breathe.
",9464,"Categories: Aqua Rabbit, Pokemon","Tags: Aqua Rabbit, azumarill, Thick Fat",300 in stock
Sudowoodo,£54.00,https://scrapeme.live/shop/Sudowoodo/,"
Sudowoodo camouflages itself as a tree to avoid being attacked by enemies. However, because its hands remain green throughout the year, the Pokémon is easily identified as a fake during the winter.
",1558,"Categories: Imitation, Pokemon","Tags: Imitation, Rock Head, sudowoodo",147 in stock
Politoed,£193.00,https://scrapeme.live/shop/Politoed/,"
The curled hair on Politoed’s head is proof of its status as a king. It is said that the longer and more curled the hair, the more respect this Pokémon earns from its peers.
",9168,"Categories: Frog, Pokemon","Tags: Damp, Frog, politoed",261 in stock
Hoppip,£107.00,https://scrapeme.live/shop/Hoppip/,"
This Pokémon drifts and floats with the wind. If it senses the approach of strong winds, Hoppip links its leaves with other Hoppip to prepare against being blown away.
",1154,"Categories: Cottonweed, Pokemon","Tags: Chlorophyll, Cottonweed, hoppip",266 in stock
Skiploom,£185.00,https://scrapeme.live/shop/Skiploom/,"
Skiploom’s flower blossoms when the temperature rises above 64 degrees Fahrenheit. How much the flower opens depends on the temperature. For that reason, this Pokémon is sometimes used as a thermometer.
",2616,"Categories: Cottonweed, Pokemon","Tags: Chlorophyll, Cottonweed, skiploom",94 in stock
Jumpluff,£107.00,https://scrapeme.live/shop/Jumpluff/,"
Jumpluff rides warm southern winds to cross the sea and fly to foreign lands. The Pokémon descends to the ground when it encounters cold air while it is floating.
",2168,"Categories: Cottonweed, Pokemon","Tags: Chlorophyll, Cottonweed, jumpluff",235 in stock
Aipom,£182.00,https://scrapeme.live/shop/Aipom/,"
Aipom’s tail ends in a hand-like appendage that can be cleverly manipulated. However, because the Pokémon uses its tail so much, its real hands have become rather clumsy.
",8103,"Categories: Long Tail, Pokemon","Tags: aipom, Long Tail, Run Away",92 in stock
Sunkern,£150.00,https://scrapeme.live/shop/Sunkern/,"
Sunkern tries to move as little as it possibly can. It does so because it tries to conserve all the nutrients it has stored in its body for its evolution. It will not eat a thing, subsisting only on morning dew.
",4061,"Categories: Pokemon, Seed","Tags: Chlorophyll, Seed, sunkern",255 in stock
Sunflora,£33.00,https://scrapeme.live/shop/Sunflora/,"
Sunflora converts solar energy into nutrition. It moves around actively in the daytime when it is warm. It stops moving as soon as the sun goes down for the night.
",7947,"Categories: Pokemon, Sun","Tags: Chlorophyll, sun, sunflora",163 in stock
Yanma,£130.00,https://scrapeme.live/shop/Yanma/,"
Yanma is capable of seeing 360 degrees without having to move its eyes. It is a great flier that is adept at making sudden stops and turning midair. This Pokémon uses its flying ability to quickly chase down targeted prey.
",8321,"Categories: Clear Wing, Pokemon","Tags: Clear Wing, Compound Eyes, yanma",130 in stock
Wooper,£98.00,https://scrapeme.live/shop/Wooper/,"
Wooper usually lives in water. However, it occasionally comes out onto land in search of food. On land, it coats its body with a gooey, toxic film.
",4198,"Categories: Pokemon, Water Fish","Tags: Damp, Water Fish, wooper",48 in stock
Quagsire,£37.00,https://scrapeme.live/shop/Quagsire/,"
Quagsire hunts for food by leaving its mouth wide open in water and waiting for its prey to blunder in unaware. Because the Pokémon does not move, it does not get very hungry.
",2688,"Categories: Pokemon, Water Fish","Tags: Damp, quagsire, Water Fish",292 in stock
Espeon,£177.00,https://scrapeme.live/shop/Espeon/,"
Espeon is extremely loyal to any Trainer it considers to be worthy. It is said that this Pokémon developed its precognitive powers to protect its Trainer from harm.
",9676,"Categories: Pokemon, Sun","Tags: espeon, sun, Synchronize",153 in stock
Umbreon,£78.00,https://scrapeme.live/shop/Umbreon/,"
Umbreon evolved as a result of exposure to the moon’s waves. It hides silently in darkness and waits for its foes to make a move. The rings on its body glow when it leaps to attack.
",4995,"Categories: Moonlight, Pokemon","Tags: Moonlight, Synchronize, umbreon",186 in stock
Murkrow,£178.00,https://scrapeme.live/shop/Murkrow/,"
Murkrow was feared and loathed as the alleged bearer of ill fortune. This Pokémon shows strong interest in anything that sparkles or glitters. It will even try to steal rings from women.
",2223,"Categories: Darkness, Pokemon","Tags: Darkness, Insomnia, murkrow",246 in stock
Slowking,£174.00,https://scrapeme.live/shop/Slowking/,"
Slowking undertakes research every day in an effort to solve the mysteries of the world. However, this Pokémon apparently forgets everything it has learned if the Shellder on its head comes off.
",9664,"Categories: Pokemon, Royal","Tags: Oblivious, Royal, slowking",55 in stock
Misdreavus,£33.00,https://scrapeme.live/shop/Misdreavus/,"
Misdreavus frightens people with a creepy, sobbing cry. The Pokémon apparently uses its red spheres to absorb the fearful feelings of foes and turn them into nutrition.
",9272,"Categories: Pokemon, Screech","Tags: Levitate, misdreavus, Screech",207 in stock
Unown,£198.00,https://scrapeme.live/shop/Unown/,"
This Pokémon is shaped like ancient writing. It is a mystery as to which came first, the ancient writings or the various Unown. Research into this topic is ongoing but nothing is known.
",9561,"Categories: Pokemon, Symbol","Tags: Levitate, Symbol, unown",47 in stock
Wobbuffet,£107.00,https://scrapeme.live/shop/Wobbuffet/,"
Wobbuffet does nothing but endure attacks—it won’t attack on its own. However, it won’t endure an attack on its tail. When that happens, the Pokémon will try to take the foe with it using Destiny Bond.
",6138,"Categories: Patient, Pokemon","Tags: Patient, Shadow Tag, wobbuffet",113 in stock
Girafarig,£99.00,https://scrapeme.live/shop/Girafarig/,"
Girafarig’s rear head contains a tiny brain that is too small for thinking. However, the rear head doesn’t need to sleep, so it can keep watch over its surroundings 24 hours a day.
",7871,"Categories: Long Neck, Pokemon","Tags: girafarig, Inner Focus, Long Neck",31 in stock
Gligar,£112.00,https://scrapeme.live/shop/Gligar/,"
Gligar glides through the air without a sound as if it were sliding. This Pokémon hangs on to the face of its foe using its clawed hind legs and the large pincers on its forelegs, then injects the prey with its poison barb.
",5090,"Categories: Fly Scorpion, Pokemon","Tags: Fly Scorpion, gligar, Sand Veil",140 in stock
Steelix,£116.00,https://scrapeme.live/shop/Steelix/,"
Steelix lives even further underground than Onix. This Pokémon is known to dig toward the earth’s core. There are records of this Pokémon reaching a depth of over six-tenths of a mile underground.
",4345,"Categories: Iron Snake, Pokemon","Tags: Iron Snake, Rock Head, steelix",157 in stock
Snubbull,£63.00,https://scrapeme.live/shop/Snubbull/,"
By baring its fangs and making a scary face, Snubbull sends smaller Pokémon scurrying away in terror. However, this Pokémon seems a little sad at making its foes flee.
",3961,"Categories: Fairy, Pokemon","Tags: Fairy, Run Away, snubbull",164 in stock
Granbull,£59.00,https://scrapeme.live/shop/Granbull/,"
Granbull has a particularly well-developed lower jaw. The enormous fangs are heavy, causing the Pokémon to tip its head back for balance. Unless it is startled, it will not try to bite indiscriminately.
",7346,"Categories: Fairy, Pokemon","Tags: Fairy, granbull, Intimidate",171 in stock
Qwilfish,£77.00,https://scrapeme.live/shop/Qwilfish/,"
Qwilfish sucks in water, inflating itself. This Pokémon uses the pressure of the water it swallowed to shoot toxic quills all at once from all over its body. It finds swimming somewhat challenging.
",3335,"Categories: Balloon, Pokemon","Tags: Balloon, Poison Point, qwilfish",297 in stock
Scizor,£172.00,https://scrapeme.live/shop/Scizor/,"
Scizor has a body with the hardness of steel. It is not easily fazed by ordinary sorts of attacks. This Pokémon flaps its wings to regulate its body temperature.
",9056,"Categories: Pincer, Pokemon","Tags: Pincer, scizor, Swarm",198 in stock
Shuckle,£194.00,https://scrapeme.live/shop/Shuckle/,"
Shuckle quietly hides itself under rocks, keeping its body concealed inside its hard shell while eating berries it has stored away. The berries mix with its body fluids to become a juice.
",7903,"Categories: Mold, Pokemon","Tags: Mold, shuckle, Sturdy",74 in stock
Heracross,£143.00,https://scrapeme.live/shop/Heracross/,"
Heracross has sharp claws on its feet. These are planted firmly into the ground or the bark of a tree, giving the Pokémon a secure and solid footing to forcefully fling away foes with its proud horn.
",9256,"Categories: Pokemon, Single Horn","Tags: heracross, Single Horn, Swarm",49 in stock
Sneasel,£108.00,https://scrapeme.live/shop/Sneasel/,"
Sneasel scales trees by punching its hooked claws into the bark. This Pokémon seeks out unguarded nests and steals eggs for food while the parents are away.
",5017,"Categories: Pokemon, Sharp Claw","Tags: Keen Eye, Sharp Claw, sneasel",141 in stock
Teddiursa,£173.00,https://scrapeme.live/shop/Teddiursa/,"
This Pokémon likes to lick its palms that are sweetened by being soaked in honey. Teddiursa concocts its own honey by blending fruits and pollen collected by Beedrill.
",7681,"Categories: Little Bear, Pokemon","Tags: Little Bear, Pickup, teddiursa",274 in stock
Ursaring,£31.00,https://scrapeme.live/shop/Ursaring/,"
In the forests inhabited by Ursaring, it is said that there are many streams and towering trees where they gather food. This Pokémon walks through its forest gathering food every day.
",7576,"Categories: Hibernator, Pokemon","Tags: Guts, Hibernator, ursaring",209 in stock
Magcargo,£36.00,https://scrapeme.live/shop/Magcargo/,"
Magcargo’s body temperature is approximately 18,000 degrees Fahrenheit. Water is vaporized on contact. If this Pokémon is caught in the rain, the raindrops instantly turn into steam, cloaking the area in a thick fog.
",3917,"Categories: Lava, Pokemon","Tags: Flame Body, Lava, magcargo",210 in stock
Swinub,£132.00,https://scrapeme.live/shop/Swinub/,"
Swinub roots for food by rubbing its snout against the ground. Its favorite food is a mushroom that grows under the cover of dead grass. This Pokémon occasionally roots out hot springs.
",8647,"Categories: Pig, Pokemon","Tags: Oblivious, Pig, swinub",250 in stock
Piloswine,£84.00,https://scrapeme.live/shop/Piloswine/,"
Piloswine is covered by a thick coat of long hair that enables it to endure the freezing cold. This Pokémon uses its tusks to dig up food that has been buried under ice.
",4003,"Categories: Pokemon, Swine","Tags: Oblivious, piloswine, Swine",276 in stock
Corsola,£27.00,https://scrapeme.live/shop/Corsola/,"
Clusters of Corsola congregate in warm seas where they serve as ideal hiding places for smaller Pokémon. When the water temperature falls, this Pokémon migrates to the southern seas.
",5281,"Categories: Coral, Pokemon","Tags: Coral, corsola, Natural Cure",162 in stock
Remoraid,£122.00,https://scrapeme.live/shop/Remoraid/,"
Remoraid sucks in water, then expels it at high velocity using its abdominal muscles to shoot down flying prey. When evolution draws near, this Pokémon travels downstream from rivers.
",4952,"Categories: Jet, Pokemon","Tags: Jet, remoraid, Sniper",46 in stock
Octillery,£94.00,https://scrapeme.live/shop/Octillery/,"
Octillery grabs onto its foe using its tentacles. This Pokémon tries to immobilize it before delivering the finishing blow. If the foe turns out to be too strong, Octillery spews ink to escape.
",9000,"Categories: Jet, Pokemon","Tags: Jet, octillery, Sniper",150 in stock
Delibird,£121.00,https://scrapeme.live/shop/Delibird/,"
Delibird carries its food bundled up in its tail. There once was a famous explorer who managed to reach the peak of the world’s highest mountain, thanks to one of these Pokémon sharing its food.
",6280,"Categories: Delivery, Pokemon","Tags: delibird, Delivery, Vital Spirit",141 in stock
Mantine,£114.00,https://scrapeme.live/shop/Mantine/,"
On sunny days, schools of Mantine can be seen elegantly leaping over the sea’s waves. This Pokémon is not bothered by the Remoraid that hitches rides.
",3704,"Categories: Kite, Pokemon","Tags: Kite, mantine, Water Absorb",195 in stock
Skarmory,£199.00,https://scrapeme.live/shop/Skarmory/,"
Skarmory’s steel wings become tattered and bashed in from repeated battles. Once a year, the battered wings grow back completely, restoring the cutting edges to their pristine state.
",1057,"Categories: Armor Bird, Pokemon","Tags: Armor Bird, Keen Eye, skarmory",102 in stock
Houndour,£144.00,https://scrapeme.live/shop/Houndour/,"
Houndour hunt as a coordinated pack. They communicate with each other using a variety of cries to corner their prey. This Pokémon’s remarkable teamwork is unparalleled.
",7965,"Categories: Dark, Pokemon","Tags: Dark, Flash Fire, houndour",184 in stock
Houndoom,£78.00,https://scrapeme.live/shop/Houndoom/,"
In a Houndoom pack, the one with its horns raked sharply toward the back serves a leadership role. These Pokémon choose their leader by fighting among themselves.
",2081,"Categories: Dark, Pokemon","Tags: Dark, Flash Fire, houndoom",40 in stock
Kingdra,£124.00,https://scrapeme.live/shop/Kingdra/,"
Kingdra sleeps on the seafloor where it is otherwise devoid of life. When a storm arrives, the Pokémon is said to awaken and wander about in search of prey.
",7090,"Categories: Dragon, Pokemon","Tags: Dragon, kingdra, Swift Swim",206 in stock
Phanpy,£129.00,https://scrapeme.live/shop/Phanpy/,"
Phanpy uses its long nose to shower itself. When others gather around, they thoroughly douse each other with water. These Pokémon can be seen drying their soaking-wet bodies at the edge of water.
",7852,"Categories: Long Nose, Pokemon","Tags: Long Nose, phanpy, Pickup",120 in stock
Donphan,£89.00,https://scrapeme.live/shop/Donphan/,"
If Donphan were to tackle with its hard body, even a house could be destroyed. Using its massive strength, the Pokémon helps clear rock and mud slides that block mountain trails.
",3134,"Categories: Armor, Pokemon","Tags: Armor, donphan, Sturdy",197 in stock
Porygon2,£151.00,https://scrapeme.live/shop/Porygon2/,"
Porygon2 was created by humans using the power of science. The man-made Pokémon has been endowed with artificial intelligence that enables it to learn new gestures and emotions on its own.
",4420,"Categories: Pokemon, Virtual","Tags: porygon2, Trace, Virtual",210 in stock
Stantler,£33.00,https://scrapeme.live/shop/Stantler/,"
Stantler’s magnificent antlers were traded at high prices as works of art. As a result, this Pokémon was hunted close to extinction by those who were after the priceless antlers.
",3706,"Categories: Big Horn, Pokemon","Tags: Big Horn, Intimidate, stantler",278 in stock
Smeargle,£151.00,https://scrapeme.live/shop/Smeargle/,"
Smeargle marks the boundaries of its territory using a body fluid that leaks out from the tip of its tail. Over 5,000 different marks left by this Pokémon have been found.
",6497,"Categories: Painter, Pokemon","Tags: Painter, smeargle, Technician",56 in stock
Tyrogue,£145.00,https://scrapeme.live/shop/Tyrogue/,"
Tyrogue becomes stressed out if it does not get to train every day. When raising this Pokémon, the Trainer must establish and uphold various training methods.
",7594,"Categories: Pokemon, Scuffle","Tags: Guts, Scuffle, tyrogue",76 in stock
Hitmontop,£149.00,https://scrapeme.live/shop/Hitmontop/,"
Hitmontop spins on its head at high speed, all the while delivering kicks. This technique is a remarkable mix of both offense and defense at the same time. The Pokémon travels faster spinning than it does walking.
",3340,"Categories: Handstand, Pokemon","Tags: Handstand, hitmontop, Intimidate",47 in stock
Smoochum,£166.00,https://scrapeme.live/shop/Smoochum/,"
Smoochum actively runs about, but also falls quite often. Whenever the chance arrives, it will look for its reflection to make sure its face hasn’t become dirty.
",7637,"Categories: Kiss, Pokemon","Tags: Kiss, Oblivious, smoochum",116 in stock
Elekid,£104.00,https://scrapeme.live/shop/Elekid/,"
Elekid stores electricity in its body. If it touches metal and accidentally discharges all its built-up electricity, this Pokémon begins swinging its arms in circles to recharge itself.
",5157,"Categories: Electric, Pokemon","Tags: Electric, elekid, Static",131 in stock
Magby,£40.00,https://scrapeme.live/shop/Magby/,"
Magby’s state of health is determined by observing the fire it breathes. If the Pokémon is spouting yellow flames from its mouth, it is in good health. When it is fatigued, black smoke will be mixed in with the flames.
",5864,"Categories: Live Coal, Pokemon","Tags: Flame Body, Live Coal, magby",21 in stock
Miltank,£26.00,https://scrapeme.live/shop/Miltank/,"
Miltank gives over five gallons of milk on a daily basis. Its sweet milk is enjoyed by children and grown-ups alike. People who can’t drink milk turn it into yogurt and eat it instead.
",1586,"Categories: Milk Cow, Pokemon","Tags: Milk Cow, miltank, Thick Fat",12 in stock
