Name,Price,Link,Description,SKU,Category,Tags,Stock
Gigalith,£67.00,https://scrapeme.live/shop/Gigalith/,"
Compressing the energy from its internal core lets it fire off an attack capable of blowing away a mountain.
",7277,"Categories: Compressed, Pokemon","Tags: Compressed, gigalith, Sturdy",18 in stock
Woobat,£27.00,https://scrapeme.live/shop/Woobat/,"
The heart-shaped mark left on a body after a Woobat has been attached to it is said to bring good fortune.
",5333,"Categories: Bat, Pokemon","Tags: Bat, Unaware, woobat",289 in stock
Swoobat,£49.00,https://scrapeme.live/shop/Swoobat/,"
Anyone who comes into contact with the ultrasonic waves emitted by a courting male experiences a positive mood shift.
",6207,"Categories: Courting, Pokemon","Tags: Courting, swoobat, Unaware",109 in stock
Drilbur,£132.00,https://scrapeme.live/shop/Drilbur/,"
By spinning its body, it can dig straight through the ground at a speed of 30 mph.
",4925,"Categories: Mole, Pokemon","Tags: drilbur, Mole, Sand Rush",171 in stock
Excadrill,£36.00,https://scrapeme.live/shop/Excadrill/,"
More than 300 feet below the surface, they build mazelike nests. Their activity can be destructive to subway tunnels.
",7949,"Categories: Pokemon, Subterrene","Tags: excadrill, Sand Rush, Subterrene",49 in stock
Audino,£95.00,https://scrapeme.live/shop/Audino/,"
It touches others with the feelers on its ears, using the sound of their heartbeats to tell how they are feeling.
",5659,"Categories: Hearing, Pokemon","Tags: audino, Healer, Hearing",109 in stock
Timburr,£194.00,https://scrapeme.live/shop/Timburr/,"
Always carrying squared logs, they help out with construction. As they grow, they carry bigger logs.
",2178,"Categories: Muscular, Pokemon","Tags: Guts, Muscular, timburr",150 in stock
Gurdurr,£179.00,https://scrapeme.live/shop/Gurdurr/,"
This Pokémon is so muscular and strongly built that even a group of wrestlers could not make it budge an inch.
",8012,"Categories: Muscular, Pokemon","Tags: gurdurr, Guts, Muscular",105 in stock
Conkeldurr,£72.00,https://scrapeme.live/shop/Conkeldurr/,"
Rather than rely on force, they master moves that utilize the centrifugal force of spinning concrete.
",3386,"Categories: Muscular, Pokemon","Tags: conkeldurr, Guts, Muscular",251 in stock
Palpitoad,£117.00,https://scrapeme.live/shop/Palpitoad/,"
It lives in the water and on land. It uses its long, sticky tongue to immobilize its opponents.
",8017,"Categories: Pokemon, Vibration","Tags: Hydration, palpitoad, Vibration",36 in stock
Seismitoad,£90.00,https://scrapeme.live/shop/Seismitoad/,"
They shoot paralyzing liquid from their head bumps. They use vibration to hurt their opponents.
",4146,"Categories: Pokemon, Vibration","Tags: seismitoad, Swift Swim, Vibration",252 in stock
Throh,£43.00,https://scrapeme.live/shop/Throh/,"
When it encounters a foe bigger than itself, it wants to throw it. It changes belts as it gets stronger.
",3948,"Categories: Judo, Pokemon","Tags: Guts, Judo, throh",195 in stock
Sawk,£129.00,https://scrapeme.live/shop/Sawk/,"
Tying their belts gets them pumped and makes their punches more destructive. Disturbing their training angers them.
",6499,"Categories: Karate, Pokemon","Tags: Inner Focus, Karate, sawk",95 in stock
Sewaddle,£40.00,https://scrapeme.live/shop/Sewaddle/,"
Since this Pokémon makes its own clothes out of leaves, it is a popular mascot for fashion designers.
",4022,"Categories: Pokemon, Sewing","Tags: sewaddle, Sewing, Swarm",137 in stock
Swadloon,£107.00,https://scrapeme.live/shop/Swadloon/,"
It protects itself from the cold by wrapping up in leaves. It stays on the move, eating leaves in forests.
",9505,"Categories: Leaf-Wrapped, Pokemon","Tags: Chlorophyll, Leaf-Wrapped, swadloon",176 in stock
Leavanny,£130.00,https://scrapeme.live/shop/Leavanny/,"
It keeps its eggs warm with heat from fermenting leaves. It also uses leaves to make warm wrappings for Sewaddle.
",5048,"Categories: Nurturing, Pokemon","Tags: leavanny, Nurturing, Swarm",203 in stock
Venipede,£87.00,https://scrapeme.live/shop/Venipede/,"
Its bite injects a potent poison, enough to paralyze large bird Pokémon that try to prey on it.
",4582,"Categories: Centipede, Pokemon","Tags: Centipede, Swarm, venipede",243 in stock
Whirlipede,£84.00,https://scrapeme.live/shop/Whirlipede/,"
It is usually motionless, but when attacked, it rotates at high speed and then crashes into its opponent.
",6342,"Categories: Curlipede, Pokemon","Tags: Curlipede, Swarm, whirlipede",170 in stock
Scolipede,£153.00,https://scrapeme.live/shop/Scolipede/,"
With quick movements, it chases down its foes, attacking relentlessly with its horns until it prevails.
",7491,"Categories: Megapede, Pokemon","Tags: Megapede, scolipede, Swarm",28 in stock
Cottonee,£77.00,https://scrapeme.live/shop/Cottonee/,"
Perhaps because they feel more at ease in a group, they stick to others they find. They end up looking like a cloud.
",3946,"Categories: Cotton Puff, Pokemon","Tags: Cotton Puff, cottonee, Prankster",139 in stock
Whimsicott,£26.00,https://scrapeme.live/shop/Whimsicott/,"
Like the wind, it can slip through any gap, no matter how small. It leaves balls of white fluff behind.
",6481,"Categories: Pokemon, Windveiled","Tags: Prankster, whimsicott, Windveiled",30 in stock
Petilil,£118.00,https://scrapeme.live/shop/Petilil/,"
Since they prefer moist, nutrient-rich soil, the areas where Petilil live are known to be good for growing plants.
",3773,"Categories: Bulb, Pokemon","Tags: Bulb, Chlorophyll, petilil",109 in stock
Lilligant,£137.00,https://scrapeme.live/shop/Lilligant/,"
Even veteran Trainers face a challenge in getting its beautiful flower to bloom. This Pokémon is popular with celebrities.
",4452,"Categories: Flowering, Pokemon","Tags: Chlorophyll, Flowering, lilligant",209 in stock
Sandile,£136.00,https://scrapeme.live/shop/Sandile/,"
They live buried in the sands of the desert. The sun-warmed sands prevent their body temperature from dropping.
",8011,"Categories: Desert Croc, Pokemon","Tags: Desert Croc, Intimidate, sandile",235 in stock
Krokorok,£135.00,https://scrapeme.live/shop/Krokorok/,"
The special membrane covering its eyes can sense the heat of objects, so it can see its surroundings even in darkness.
",3317,"Categories: Desert Croc, Pokemon","Tags: Desert Croc, Intimidate, krokorok",168 in stock
Krookodile,£185.00,https://scrapeme.live/shop/Krookodile/,"
They never allow prey to escape. Their jaws are so powerful, they can crush the body of an automobile.
",2595,"Categories: Intimidation, Pokemon","Tags: Intimidate, Intimidation, krookodile",188 in stock
Darumaka,£106.00,https://scrapeme.live/shop/Darumaka/,"
When it sleeps, it pulls its limbs into its body and its internal fire goes down to 1,100 degrees Fahrenheit.
",2580,"Categories: Pokemon, Zen Charm","Tags: darumaka, Hustle, Zen Charm",96 in stock
Maractus,£31.00,https://scrapeme.live/shop/Maractus/,"
Arid regions are their habitat. They move rhythmically, making a sound similar to maracas.
",8956,"Categories: Cactus, Pokemon","Tags: Cactus, Chlorophyll, maractus",120 in stock
Dwebble,£75.00,https://scrapeme.live/shop/Dwebble/,"
When it finds a stone of a suitable size, it secretes a liquid from its mouth to open up a hole to crawl into.
",2996,"Categories: Pokemon, Rock Inn","Tags: dwebble, Rock Inn, Sturdy",47 in stock
Crustle,£105.00,https://scrapeme.live/shop/Crustle/,"
Competing for territory, Crustle fight viciously. The one whose boulder is broken is the loser of the battle.
",5980,"Categories: Pokemon, Stone Home","Tags: crustle, Stone Home, Sturdy",293 in stock
Scraggy,£112.00,https://scrapeme.live/shop/Scraggy/,"
Proud of its sturdy skull, it suddenly headbutts everything, but its weight makes it unstable, too.
",6618,"Categories: Pokemon, Shedding","Tags: scraggy, Shed Skin, Shedding",95 in stock
Scrafty,£137.00,https://scrapeme.live/shop/Scrafty/,"
It can smash concrete blocks with its kicking attacks. The one with the biggest crest is the group leader.
",2230,"Categories: Hoodlum, Pokemon","Tags: Hoodlum, scrafty, Shed Skin",152 in stock
Sigilyph,£68.00,https://scrapeme.live/shop/Sigilyph/,"
The guardians of an ancient city, they always fly the same route while keeping watch for invaders.
",3922,"Categories: Avianoid, Pokemon","Tags: Avianoid, Magic Guard, sigilyph",181 in stock
Yamask,£171.00,https://scrapeme.live/shop/Yamask/,"
Each of them carries a mask that used to be its face when it was human. Sometimes they look at it and cry.
",4675,"Categories: Pokemon, Spirit","Tags: Mummy, Spirit, yamask",168 in stock
Cofagrigus,£160.00,https://scrapeme.live/shop/Cofagrigus/,"
Grave robbers who mistake them for real coffins and get too close end up trapped inside their bodies.
",3040,"Categories: Coffin, Pokemon","Tags: cofagrigus, Coffin, Mummy",195 in stock
Tirtouga,£60.00,https://scrapeme.live/shop/Tirtouga/,"
Restored from a fossil, this Pokémon can dive to depths beyond half a mile.
",2653,"Categories: Pokemon, Prototurtle","Tags: Prototurtle, Sturdy, tirtouga",98 in stock
Carracosta,£158.00,https://scrapeme.live/shop/Carracosta/,"
It could knock out a foe with a slap from one of its developed front appendages and chew it up, shell or bones and all.
",9806,"Categories: Pokemon, Prototurtle","Tags: carracosta, Prototurtle, Sturdy",11 in stock
Archen,£140.00,https://scrapeme.live/shop/Archen/,"
Said to be an ancestor of bird Pokémon, they were unable to fly and moved about by hopping from one branch to another.
",4705,"Categories: First Bird, Pokemon","Tags: archen, Defeatist, First Bird",267 in stock
Archeops,£126.00,https://scrapeme.live/shop/Archeops/,"
It runs better than it flies. It takes off into the sky by running at a speed of 25 mph.
",1822,"Categories: First Bird, Pokemon","Tags: archeops, Defeatist, First Bird",181 in stock
Trubbish,£169.00,https://scrapeme.live/shop/Trubbish/,"
Inhaling the gas they belch will make you sleep for a week. They prefer unsanitary places.
",3015,"Categories: Pokemon, Trash Bag","Tags: Stench, Trash Bag, trubbish",229 in stock
Garbodor,£178.00,https://scrapeme.live/shop/Garbodor/,"
Consuming garbage makes new kinds of poison gases and liquids inside their bodies.
",6031,"Categories: Pokemon, Trash Heap","Tags: garbodor, Stench, Trash Heap",73 in stock
Zorua,£81.00,https://scrapeme.live/shop/Zorua/,"
To protect themselves from danger, they hide their true identities by transforming into people and Pokémon.
",6103,"Categories: Pokemon, Tricky Fox","Tags: Illusion, Tricky Fox, zorua",245 in stock
Minccino,£79.00,https://scrapeme.live/shop/Minccino/,"
These Pokémon prefer a tidy habitat. They are always sweeping and dusting, using their tails as brooms.
",9722,"Categories: Chinchilla, Pokemon","Tags: Chinchilla, Cute Charm, minccino",213 in stock
Cinccino,£154.00,https://scrapeme.live/shop/Cinccino/,"
Cinccino’s body is coated in a special oil that helps it deflect attacks, such as punches.
",3396,"Categories: Pokemon, Scarf","Tags: cinccino, Cute Charm, Scarf",159 in stock
Gothita,£68.00,https://scrapeme.live/shop/Gothita/,"
They intently observe both Trainers and Pokémon. Apparently, they are looking at something that only Gothita can see.
",7024,"Categories: Fixation, Pokemon","Tags: Fixation, Frisk, gothita",185 in stock
Gothorita,£189.00,https://scrapeme.live/shop/Gothorita/,"
According to many old tales, it creates friends for itself by controlling sleeping children on starry nights.
",5260,"Categories: Manipulate, Pokemon","Tags: Frisk, gothorita, Manipulate",148 in stock
Gothitelle,£164.00,https://scrapeme.live/shop/Gothitelle/,"
They can predict the future from the placement and movement of the stars. They can see Trainers’ life spans.
",1473,"Categories: Astral Body, Pokemon","Tags: Astral Body, Frisk, gothitelle",52 in stock
Solosis,£134.00,https://scrapeme.live/shop/Solosis/,"
They drive away attackers by unleashing psychic power. They can use telepathy to talk with others.
",7460,"Categories: Cell, Pokemon","Tags: Cell, Magic Guard, solosis",226 in stock
Duosion,£71.00,https://scrapeme.live/shop/Duosion/,"
When their two divided brains think the same thoughts, their psychic power is maximized.
",2453,"Categories: Mitosis, Pokemon","Tags: duosion, Magic Guard, Mitosis",183 in stock
Reuniclus,£168.00,https://scrapeme.live/shop/Reuniclus/,"
When Reuniclus shake hands, a network forms between their brains, increasing their psychic power.
",1792,"Categories: Multiplying, Pokemon","Tags: Magic Guard, Multiplying, reuniclus",193 in stock
Ducklett,£159.00,https://scrapeme.live/shop/Ducklett/,"
They are better at swimming than flying, and they happily eat their favorite food, peat moss, as they dive underwater.
",4228,"Categories: Pokemon, Water Bird","Tags: ducklett, Keen Eye, Water Bird",275 in stock
Swanna,£36.00,https://scrapeme.live/shop/Swanna/,"
Swanna start to dance at dusk. The one dancing in the middle is the leader of the flock.
",5069,"Categories: Pokemon, White Bird","Tags: Keen Eye, swanna, White Bird",238 in stock
Vanillite,£108.00,https://scrapeme.live/shop/Vanillite/,"
This Pokémon formed from icicles bathed in energy from the morning sun. It sleeps buried in snow.
",1774,"Categories: Fresh Snow, Pokemon","Tags: Fresh Snow, Ice Body, vanillite",284 in stock
Vanillish,£93.00,https://scrapeme.live/shop/Vanillish/,"
Snowy mountains are this Pokémon’s habitat. During an ancient ice age, they moved to southern areas.
",5776,"Categories: Icy Snow, Pokemon","Tags: Ice Body, Icy Snow, vanillish",218 in stock
Vanilluxe,£89.00,https://scrapeme.live/shop/Vanilluxe/,"
Swallowing large amounts of water, they make snow clouds inside their bodies and, when angry, cause violent blizzards.
",2362,"Categories: Pokemon, Snowstorm","Tags: Ice Body, Snowstorm, vanilluxe",30 in stock
Deerling,£141.00,https://scrapeme.live/shop/Deerling/,"
The turning of the seasons changes the color and scent of this Pokémon’s fur. People use it to mark the seasons.
",5837,"Categories: Pokemon, Season","Tags: Chlorophyll, deerling, Season",159 in stock
Sawsbuck,£76.00,https://scrapeme.live/shop/Sawsbuck/,"
They migrate according to the seasons, so some people call Sawsbuck the harbingers of spring.
",6782,"Categories: Pokemon, Season","Tags: Chlorophyll, sawsbuck, Season",299 in stock
Karrablast,£41.00,https://scrapeme.live/shop/Karrablast/,"
For some reason they evolve when they receive electrical energy while they are attacking Shelmet.
",9391,"Categories: Clamping, Pokemon","Tags: Clamping, karrablast, Shed Skin",296 in stock
Escavalier,£189.00,https://scrapeme.live/shop/Escavalier/,"
These Pokémon evolve by wearing the shell covering of a Shelmet. The steel armor protects their whole body.
",1906,"Categories: Cavalry, Pokemon","Tags: Cavalry, escavalier, Swarm",281 in stock
Foongus,£129.00,https://scrapeme.live/shop/Foongus/,"
It lures Pokémon with its pattern that looks just like a Poké Ball, then releases poison spores.
",7154,"Categories: Mushroom, Pokemon","Tags: Effect Spore, foongus, Mushroom",225 in stock
Frillish,£63.00,https://scrapeme.live/shop/Frillish/,"
If its veil-like arms stun and wrap a foe, that foe will be dragged miles below the surface, never to return.
",5310,"Categories: Floating, Pokemon","Tags: Floating, frillish, Water Absorb",32 in stock
Jellicent,£114.00,https://scrapeme.live/shop/Jellicent/,"
The fate of the ships and crew that wander into Jellicent’s habitat: all sunken, all lost, all vanished.
",2412,"Categories: Floating, Pokemon","Tags: Floating, jellicent, Water Absorb",216 in stock
Alomomola,£35.00,https://scrapeme.live/shop/Alomomola/,"
It gently holds injured and weak Pokémon in its fins. Its special membrane heals their wounds.
",8864,"Categories: Caring, Pokemon","Tags: alomomola, Caring, Hydration",296 in stock
Joltik,£59.00,https://scrapeme.live/shop/Joltik/,"
They attach themselves to large-bodied Pokémon and absorb static electricity, which they store in an electric pouch.
",4385,"Categories: Attaching, Pokemon","Tags: Attaching, Compound Eyes, joltik",137 in stock
Galvantula,£57.00,https://scrapeme.live/shop/Galvantula/,"
When attacked, they create an electric barrier by spitting out many electrically charged threads.
",4595,"Categories: EleSpider, Pokemon","Tags: Compound Eyes, EleSpider, galvantula",61 in stock
Ferroseed,£81.00,https://scrapeme.live/shop/Ferroseed/,"
It absorbs the iron it finds in the rock while clinging to the ceiling. It shoots spikes when in danger.
",5368,"Categories: Pokemon, Thorn Seed","Tags: ferroseed, Iron Barbs, Thorn Seed",149 in stock
Ferrothorn,£182.00,https://scrapeme.live/shop/Ferrothorn/,"
They attach themselves to cave ceilings, firing steel spikes at targets passing beneath them.
",5533,"Categories: Pokemon, Thorn Pod","Tags: ferrothorn, Iron Barbs, Thorn Pod",74 in stock
Klink,£75.00,https://scrapeme.live/shop/Klink/,"
The two minigears that mesh together are predetermined. Each will rebound from other minigears without meshing.
",5294,"Categories: Gear, Pokemon","Tags: Gear, klink, Plus",84 in stock
Klang,£162.00,https://scrapeme.live/shop/Klang/,"
A minigear and big gear comprise its body. If the minigear it launches at a foe doesn’t return, it will die.
",9991,"Categories: Gear, Pokemon","Tags: Gear, klang, Plus",114 in stock
Klinklang,£178.00,https://scrapeme.live/shop/Klinklang/,"
Its red core functions as an energy tank. It fires the charged energy through its spikes into an area.
",9489,"Categories: Gear, Pokemon","Tags: Gear, klinklang, Plus",87 in stock
Tynamo,£82.00,https://scrapeme.live/shop/Tynamo/,"
One alone can emit only a trickle of electricity, so a group of them gathers to unleash a powerful electric shock.
",7438,"Categories: EleFish, Pokemon","Tags: EleFish, Levitate, tynamo",46 in stock
Eelektrik,£198.00,https://scrapeme.live/shop/Eelektrik/,"
These Pokémon have a big appetite. When they spot their prey, they attack it and paralyze it with electricity.
",5128,"Categories: EleFish, Pokemon","Tags: eelektrik, EleFish, Levitate",150 in stock
Eelektross,£123.00,https://scrapeme.live/shop/Eelektross/,"
They crawl out of the ocean using their arms. They will attack prey on shore and immediately drag it into the ocean.
",2066,"Categories: EleFish, Pokemon","Tags: eelektross, EleFish, Levitate",111 in stock
Elgyem,£107.00,https://scrapeme.live/shop/Elgyem/,"
Rumors of its origin are linked to a UFO crash site in the desert 50 years ago.
",3449,"Categories: Cerebral, Pokemon","Tags: Cerebral, elgyem, Synchronize",111 in stock
Beheeyem,£34.00,https://scrapeme.live/shop/Beheeyem/,"
It uses psychic power to control an opponent’s brain and tamper with its memories.
",7367,"Categories: Cerebral, Pokemon","Tags: beheeyem, Cerebral, Synchronize",68 in stock
Litwick,£37.00,https://scrapeme.live/shop/Litwick/,"
Litwick shines a light that absorbs the life energy of people and Pokémon, which becomes the fuel that it burns.
",7933,"Categories: Candle, Pokemon","Tags: Candle, Flash Fire, litwick",76 in stock
Lampent,£157.00,https://scrapeme.live/shop/Lampent/,"
It arrives near the moment of death and steals spirit from the body.
",6418,"Categories: Lamp, Pokemon","Tags: Flash Fire, Lamp, lampent",48 in stock
Axew,£123.00,https://scrapeme.live/shop/Axew/,"
They mark their territory by leaving gashes in trees with their tusks. If a tusk breaks, a new one grows in quickly.
",9236,"Categories: Pokemon, Tusk","Tags: axew, Rivalry, Tusk",142 in stock
Fraxure,£64.00,https://scrapeme.live/shop/Fraxure/,"
A broken tusk will not grow back, so it diligently sharpens its tusks on river rocks after the end of a battle.
",8993,"Categories: Axe Jaw, Pokemon","Tags: Axe Jaw, fraxure, Rivalry",234 in stock
Haxorus,£135.00,https://scrapeme.live/shop/Haxorus/,"
Their sturdy tusks will stay sharp even if used to cut steel beams. These Pokémon are covered in hard armor.
",3951,"Categories: Axe Jaw, Pokemon","Tags: Axe Jaw, haxorus, Rivalry",239 in stock
Cubchoo,£62.00,https://scrapeme.live/shop/Cubchoo/,"
Their snot is a barometer of health. When healthy, their snot is sticky and the power of their ice moves increases.
",3643,"Categories: Chill, Pokemon","Tags: Chill, cubchoo, Snow Cloak",45 in stock
Beartic,£28.00,https://scrapeme.live/shop/Beartic/,"
It freezes its breath to create fangs and claws of ice to fight with. Cold northern areas are its habitat.
",1322,"Categories: Freezing, Pokemon","Tags: beartic, Freezing, Snow Cloak",272 in stock
Cryogonal,£72.00,https://scrapeme.live/shop/Cryogonal/,"
They are composed of ice crystals. They capture prey with chains of ice, freezing the prey at -148 degrees Fahrenheit.
",5993,"Categories: Crystallizing, Pokemon","Tags: cryogonal, Crystallizing, Levitate",203 in stock
Shelmet,£190.00,https://scrapeme.live/shop/Shelmet/,"
It evolves when bathed in an electric-like energy along with Karrablast. The reason is still unknown.
",8708,"Categories: Pokemon, Snail","Tags: Hydration, shelmet, Snail",131 in stock
Accelgor,£129.00,https://scrapeme.live/shop/Accelgor/,"
When its body dries out, it weakens. So, to prevent dehydration, it wraps itself in many layers of thin membrane.
",7958,"Categories: Pokemon, Shell Out","Tags: accelgor, Hydration, Shell Out",124 in stock
Stunfisk,£67.00,https://scrapeme.live/shop/Stunfisk/,"
It conceals itself in the mud of the seashore. Then it waits. When prey touch it, it delivers a jolt of electricity.
",2448,"Categories: Pokemon, Trap","Tags: Static, stunfisk, Trap",288 in stock
Mienfoo,£197.00,https://scrapeme.live/shop/Mienfoo/,"
In fights, they dominate with onslaughts of flowing, continuous attacks. With their sharp claws, they cut enemies.
",2424,"Categories: Martial Arts, Pokemon","Tags: Inner Focus, Martial Arts, mienfoo",82 in stock
Mienshao,£50.00,https://scrapeme.live/shop/Mienshao/,"
Using the long fur on its arms like whips, it launches into combo attacks that, once started, no one can stop.
",8121,"Categories: Martial Arts, Pokemon","Tags: Inner Focus, Martial Arts, mienshao",253 in stock
Druddigon,£110.00,https://scrapeme.live/shop/Druddigon/,"
It warms its body by absorbing sunlight with its wings. When its body temperature falls, it can no longer move.
",4185,"Categories: Cave, Pokemon","Tags: Cave, druddigon, Rough Skin",266 in stock
Golett,£89.00,https://scrapeme.live/shop/Golett/,"
Ancient science fashioned this Pokémon from clay. It’s been active for thousands of years.
",8500,"Categories: Automaton, Pokemon","Tags: Automaton, golett, Iron Fist",274 in stock
Golurk,£74.00,https://scrapeme.live/shop/Golurk/,"
It flies across the sky at Mach speeds. Removing the seal on its chest makes its internal energy go out of control.
",5196,"Categories: Automaton, Pokemon","Tags: Automaton, golurk, Iron Fist",133 in stock
Pawniard,£37.00,https://scrapeme.live/shop/Pawniard/,"
Ignoring their injuries, groups attack by sinking the blades that cover their bodies into their prey.
",3172,"Categories: Pokemon, Sharp Blade","Tags: Inner Focus, pawniard, Sharp Blade",58 in stock
Bisharp,£129.00,https://scrapeme.live/shop/Bisharp/,"
Bisharp pursues prey in the company of a large group of Pawniard. Then Bisharp finishes off the prey.
",8828,"Categories: Pokemon, Sword Blade","Tags: bisharp, Inner Focus, Sword Blade",255 in stock
Bouffalant,£59.00,https://scrapeme.live/shop/Bouffalant/,"
Their fluffy fur absorbs damage, even if they strike foes with a fierce headbutt.
",5666,"Categories: Bash Buffalo, Pokemon","Tags: Bash Buffalo, bouffalant, Reckless",201 in stock
Rufflet,£60.00,https://scrapeme.live/shop/Rufflet/,"
They will challenge anything, even strong opponents, without fear. Their frequent fights help them become stronger.
",8587,"Categories: Eaglet, Pokemon","Tags: Eaglet, Keen Eye, rufflet",194 in stock
Braviary,£83.00,https://scrapeme.live/shop/Braviary/,"
They fight for their friends without any thought about danger to themselves. One can carry a car while flying.
",1770,"Categories: Pokemon, Valiant","Tags: braviary, Keen Eye, Valiant",262 in stock
Vullaby,£61.00,https://scrapeme.live/shop/Vullaby/,"
Their wings are too tiny to allow them to fly. They guard their posteriors with bones that were gathered by Mandibuzz.
",8446,"Categories: Diapered, Pokemon","Tags: Big Pecks, Diapered, vullaby",16 in stock
Mandibuzz,£89.00,https://scrapeme.live/shop/Mandibuzz/,"
Watching from the sky, they swoop to strike weakened Pokémon on the ground. They decorate themselves with bones.
",7635,"Categories: Bone Vulture, Pokemon","Tags: Big Pecks, Bone Vulture, mandibuzz",296 in stock
Heatmor,£81.00,https://scrapeme.live/shop/Heatmor/,"
It draws in air through its tail, transforms it into fire, and uses it like a tongue. It melts Durant and eats them.
",5965,"Categories: Anteater, Pokemon","Tags: Anteater, Flash Fire, heatmor",299 in stock
Durant,£28.00,https://scrapeme.live/shop/Durant/,"
They attack in groups, covering themselves in steel armor to protect themselves from Heatmor.
",2490,"Categories: Iron Ant, Pokemon","Tags: durant, Iron Ant, Swarm",272 in stock
Deino,£63.00,https://scrapeme.live/shop/Deino/,"
Lacking sight, it’s unaware of its surroundings, so it bumps into things and eats anything that moves.
",8088,"Categories: Irate, Pokemon","Tags: deino, Hustle, Irate",40 in stock
Zweilous,£199.00,https://scrapeme.live/shop/Zweilous/,"
After it has eaten up all the food in its territory, it moves to another area. Its two heads do not get along.
",6661,"Categories: Hostile, Pokemon","Tags: Hostile, Hustle, zweilous",69 in stock
Hydreigon,£86.00,https://scrapeme.live/shop/Hydreigon/,"
It responds to movement by attacking. This scary, three-headed Pokémon devours everything in its path!
",9310,"Categories: Brutal, Pokemon","Tags: Brutal, hydreigon, Levitate",299 in stock
