Name,Price,Link,Description,SKU,Category,Tags,Stock
Numel,£170.00,https://scrapeme.live/shop/Numel/,"
Numel stores magma of almost 2,200 degrees Fahrenheit within its body. If it gets wet, the magma cools and hardens. In that event, the Pokémon’s body grows heavy and its movements become sluggish.
",1767,"Categories: Numb, Pokemon","Tags: Numb, numel, Oblivious",179 in stock
Camerupt,£124.00,https://scrapeme.live/shop/Camerupt/,"
The humps on Camerupt’s back are formed by a transformation of its bones. They sometimes blast out molten magma. This Pokémon apparently erupts often when it is enraged.
",7274,"Categories: Eruption, Pokemon","Tags: camerupt, Eruption, Magma Armor",27 in stock
Torkoal,£98.00,https://scrapeme.live/shop/Torkoal/,"
Torkoal generates energy by burning coal. It grows weaker as the fire dies down. When it is preparing for battle, this Pokémon burns more coal.
",4605,"Categories: Coal, Pokemon","Tags: Coal, torkoal, White Smoke",282 in stock
Spoink,£163.00,https://scrapeme.live/shop/Spoink/,"
Spoink keeps a pearl on top of its head. The pearl functions to amplify this Pokémon’s psychokinetic powers. It is therefore on a constant search for a bigger pearl.
",7700,"Categories: Bounce, Pokemon","Tags: Bounce, Own Tempo, spoink",208 in stock
Grumpig,£182.00,https://scrapeme.live/shop/Grumpig/,"
Grumpig uses the black pearls on its body to wield its fantastic powers. When it is doing so, it dances bizarrely. This Pokémon’s black pearls are valuable as works of art.
",6263,"Categories: Manipulate, Pokemon","Tags: grumpig, Manipulate, Own Tempo",60 in stock
Spinda,£149.00,https://scrapeme.live/shop/Spinda/,"
No two Spinda are said to have identical spot patterns on their hides. This Pokémon moves in a curious manner as if it is stumbling in dizziness. Its lurching movements can cause the opponent to become confused.
",7350,"Categories: Pokemon, Spot Panda","Tags: spinda, Spot Panda, Tangled Feet",156 in stock
Trapinch,£116.00,https://scrapeme.live/shop/Trapinch/,"
Trapinch is a patient hunter. It digs an inescapable pit in a desert and waits for its prey to come tumbling down. This Pokémon can go a whole week without access to any water.
",4740,"Categories: Ant Pit, Pokemon","Tags: Ant Pit, Arena Trap, trapinch",269 in stock
Vibrava,£200.00,https://scrapeme.live/shop/Vibrava/,"
Vibrava’s wings have not yet completed the process of growing. Rather than flying long distances, they are more useful for generating ultrasonic waves by vibrating.
",9249,"Categories: Pokemon, Vibration","Tags: Levitate, Vibration, vibrava",218 in stock
Flygon,£174.00,https://scrapeme.live/shop/Flygon/,"
Flygon whips up a sandstorm by flapping its wings. The wings create a series of notes that sound like singing. Because the “singing” is the only thing that can be heard in a sandstorm, this Pokémon is said to be the desert spirit.
",4103,"Categories: Mystic, Pokemon","Tags: flygon, Levitate, Mystic",42 in stock
Cacnea,£105.00,https://scrapeme.live/shop/Cacnea/,"
The more arid and harsh the environment, the more pretty and fragrant a flower Cacnea grows. This Pokémon battles by wildly swinging its thorny arms.
",5000,"Categories: Cactus, Pokemon","Tags: cacnea, Cactus, Sand Veil",31 in stock
Cacturne,£31.00,https://scrapeme.live/shop/Cacturne/,"
If a traveler is going through a desert in the thick of night, Cacturne will follow in a ragtag group. The Pokémon are biding their time, waiting for the traveler to tire and become incapable of moving.
",8491,"Categories: Pokemon, Scarecrow","Tags: cacturne, Sand Veil, Scarecrow",204 in stock
Swablu,£121.00,https://scrapeme.live/shop/Swablu/,"
Swablu loves to make things clean. If it spots something dirty, it will wipe and polish it with its cottony wings. If its wings become dirty, this Pokémon finds a stream and showers itself.
",3915,"Categories: Cotton Bird, Pokemon","Tags: Cotton Bird, Natural Cure, swablu",169 in stock
Altaria,£104.00,https://scrapeme.live/shop/Altaria/,"
Altaria sings in a gorgeous soprano. Its wings are like cotton clouds. This Pokémon catches updrafts with its buoyant wings and soars way up into the wild blue yonder.
",9924,"Categories: Humming, Pokemon","Tags: altaria, Humming, Natural Cure",136 in stock
Seviper,£107.00,https://scrapeme.live/shop/Seviper/,"
Seviper’s swordlike tail serves two purposes—it slashes foes and douses them with secreted poison. This Pokémon will not give up its long-running blood feud with Zangoose.
",9903,"Categories: Fang Snake, Pokemon","Tags: Fang Snake, seviper, Shed Skin",300 in stock
Lunatone,£177.00,https://scrapeme.live/shop/Lunatone/,"
Lunatone becomes active around the time of the full moon. Instead of walking, it moves by floating in midair. The Pokémon’s intimidating red eyes cause all those who see it to become transfixed with fear.
",5917,"Categories: Meteorite, Pokemon","Tags: Levitate, lunatone, Meteorite",91 in stock
Solrock,£57.00,https://scrapeme.live/shop/Solrock/,"
Sunlight is the source of Solrock’s power. It is said to possess the ability to read the emotions of others. This Pokémon gives off intense heat while rotating its body.
",5510,"Categories: Meteorite, Pokemon","Tags: Levitate, Meteorite, solrock",91 in stock
Whiscash,£179.00,https://scrapeme.live/shop/Whiscash/,"
If Whiscash goes on a wild rampage, it sets off a quake-like tremor with a radius of over three miles. This Pokémon has the ability to predict real earthquakes.
",6220,"Categories: Pokemon, Whiskers","Tags: Oblivious, whiscash, Whiskers",266 in stock
Corphish,£178.00,https://scrapeme.live/shop/Corphish/,"
Corphish catches prey with its sharp claws. It has no likes or dislikes when it comes to food—it will eat anything. This Pokémon has no trouble living in filthy water.
",8905,"Categories: Pokemon, Ruffian","Tags: corphish, Ruffian, Shell Armor",62 in stock
Crawdaunt,£173.00,https://scrapeme.live/shop/Crawdaunt/,"
Crawdaunt molts (sheds) its shell regularly. Immediately after molting, its shell is soft and tender. Until the shell hardens, this Pokémon hides in its streambed burrow to avoid attack from its foes.
",3652,"Categories: Pokemon, Rogue","Tags: crawdaunt, Rogue, Shell Armor",21 in stock
Baltoy,£167.00,https://scrapeme.live/shop/Baltoy/,"
As soon as it spots others of its kind, Baltoy congregates with them and then begins crying noisily in unison. This Pokémon sleeps while cleverly balancing itself on its one foot.
",8305,"Categories: Clay Doll, Pokemon","Tags: baltoy, Clay Doll, Levitate",159 in stock
Claydol,£197.00,https://scrapeme.live/shop/Claydol/,"
Claydol is an enigma that appeared from a clay statue made by an ancient civilization dating back 20,000 years. This Pokémon shoots beams from both its hands.
",3698,"Categories: Clay Doll, Pokemon","Tags: Clay Doll, claydol, Levitate",128 in stock
Lileep,£87.00,https://scrapeme.live/shop/Lileep/,"
Lileep is an ancient Pokémon that was regenerated from a fossil. It remains permanently anchored to a rock. From its immobile perch, this Pokémon intently scans for prey with its two eyes.
",2965,"Categories: Pokemon, Sea Lily","Tags: lileep, Sea Lily, Suction Cups",268 in stock
Cradily,£154.00,https://scrapeme.live/shop/Cradily/,"
Cradily’s body serves as an anchor, preventing it from being washed away in rough seas. This Pokémon secretes a strong digestive fluid from its tentacles.
",5809,"Categories: Barnacle, Pokemon","Tags: Barnacle, cradily, Suction Cups",183 in stock
Anorith,£64.00,https://scrapeme.live/shop/Anorith/,"
Anorith is said to be a type of Pokémon predecessor, with eight wings at the sides of its body. This Pokémon swam in the primordial sea by undulating these eight wings.
",2511,"Categories: Old Shrimp, Pokemon","Tags: anorith, Battle Armor, Old Shrimp",222 in stock
Armaldo,£42.00,https://scrapeme.live/shop/Armaldo/,"
Armaldo is a Pokémon species that became extinct in prehistoric times. This Pokémon is said to have walked on its hind legs, which would have been more convenient for life on land.
",3328,"Categories: Plate, Pokemon","Tags: armaldo, Battle Armor, Plate",78 in stock
Feebas,£194.00,https://scrapeme.live/shop/Feebas/,"
While Feebas’s body is in tatters, it has a hardy and tenacious life force that enables it to live anywhere. However, this Pokémon is also slow and dimwitted, making it an easy catch.
",6505,"Categories: Fish, Pokemon","Tags: feebas, Fish, Oblivious",146 in stock
Milotic,£152.00,https://scrapeme.live/shop/Milotic/,"
Milotic live at the bottom of large lakes. When this Pokémon’s body glows a vivid pink, it releases a pulsing wave of energy that brings soothing calm to troubled hearts.
",4867,"Categories: Pokemon, Tender","Tags: Marvel Scale, milotic, Tender",79 in stock
Castform,£119.00,https://scrapeme.live/shop/Castform/,"
Castform borrows the power of nature to transform itself into the guises of the sun, rain, and snow-clouds. This Pokémon’s feelings change with the weather.
",9535,"Categories: Pokemon, Weather","Tags: castform, Forecast, Weather",131 in stock
Kecleon,£100.00,https://scrapeme.live/shop/Kecleon/,"
Kecleon alters its body coloration to blend in with its surroundings, allowing it to sneak up on its prey unnoticed. Then it lashes out with its long, stretchy tongue to instantly ensnare the unsuspecting target.
",2351,"Categories: Color Swap, Pokemon","Tags: Color Change, Color Swap, kecleon",53 in stock
Shuppet,£174.00,https://scrapeme.live/shop/Shuppet/,"
Shuppet grows by feeding on dark emotions, such as vengefulness and envy, in the hearts of people. It roams through cities in search of grudges that taint people.
",7348,"Categories: Pokemon, Puppet","Tags: Insomnia, Puppet, shuppet",138 in stock
Banette,£104.00,https://scrapeme.live/shop/Banette/,"
A cursed energy permeated the stuffing of a discarded and forgotten plush doll, giving it new life as Banette. The Pokémon’s energy would escape if it were to ever open its mouth.
",6213,"Categories: Marionette, Pokemon","Tags: banette, Insomnia, Marionette",233 in stock
Duskull,£139.00,https://scrapeme.live/shop/Duskull/,"
Duskull wanders lost among the deep darkness of midnight. There is an oft-told admonishment given to misbehaving children that this Pokémon will spirit away bad children who earn scoldings from their mothers.
",6627,"Categories: Pokemon, Requiem","Tags: duskull, Levitate, Requiem",75 in stock
Dusclops,£39.00,https://scrapeme.live/shop/Dusclops/,"
Dusclops absorbs anything, however large the object may be. This Pokémon hypnotizes its foe by waving its hands in a macabre manner and by bringing its single eye to bear. The hypnotized foe is made to do Dusclops’s bidding.
",4994,"Categories: Beckon, Pokemon","Tags: Beckon, dusclops, Pressure",82 in stock
Tropius,£196.00,https://scrapeme.live/shop/Tropius/,"
Children of the southern tropics eat as snacks the fruit that grows in bunches around the neck of Tropius. This Pokémon flies by flapping the leaves on its back as if they were wings.
",7266,"Categories: Fruit, Pokemon","Tags: Chlorophyll, fruit, tropius",66 in stock
Chimecho,£51.00,https://scrapeme.live/shop/Chimecho/,"
In high winds, Chimecho cries as it hangs from a tree branch or the eaves of a building using a suction cup on its head. This Pokémon plucks berries with its long tail and eats them.
",6688,"Categories: Pokemon, Wind Chime","Tags: chimecho, Levitate, Wind Chime",43 in stock
Absol,£134.00,https://scrapeme.live/shop/Absol/,"
Absol has the ability to foretell the coming of natural disasters. It lives in a harsh, rugged mountain environment. This Pokémon very rarely ventures down from the mountains.
",3431,"Categories: Disaster, Pokemon","Tags: absol, Disaster, Pressure",59 in stock
Wynaut,£168.00,https://scrapeme.live/shop/Wynaut/,"
Wynaut gather on moonlit nights to play by squeezing up against each other. By being squeezed, this Pokémon gains endurance and is trained to dole out powerful counterattacks.
",9836,"Categories: Bright, Pokemon","Tags: Bright, Shadow Tag, wynaut",155 in stock
Snorunt,£82.00,https://scrapeme.live/shop/Snorunt/,"
Snorunt survives by eating only snow and ice. Old folklore claims that a house visited by this Pokémon is sure to prosper for many generations to come.
",1099,"Categories: Pokemon, Snow Hat","Tags: Inner Focus, snorunt, Snow Hat",80 in stock
Glalie,£178.00,https://scrapeme.live/shop/Glalie/,"
Glalie has the ability to freely control ice. For example, it can instantly freeze its prey solid. After immobilizing its prey in ice, this Pokémon enjoys eating it in leisurely fashion.
",8582,"Categories: Face, Pokemon","Tags: Face, glalie, Inner Focus",14 in stock
Spheal,£193.00,https://scrapeme.live/shop/Spheal/,"
Spheal always travels by rolling around on its ball-like body. When the season for ice floes arrives, this Pokémon can be seen rolling about on ice and crossing the sea.
",7748,"Categories: Clap, Pokemon","Tags: Clap, spheal, Thick Fat",170 in stock
Sealeo,£160.00,https://scrapeme.live/shop/Sealeo/,"
Sealeo often balances and rolls things on the tip of its nose. While the Pokémon is rolling something, it checks the object’s aroma and texture to determine whether it likes the object or not.
",4231,"Categories: Ball Roll, Pokemon","Tags: Ball Roll, sealeo, Thick Fat",171 in stock
Walrein,£27.00,https://scrapeme.live/shop/Walrein/,"
Walrein swims all over in frigid seawater while crushing icebergs with its grand, imposing tusks. Its thick layer of blubber makes enemy attacks bounce off harmlessly.
",1600,"Categories: Ice Break, Pokemon","Tags: Ice Break, Thick Fat, walrein",226 in stock
Clamperl,£48.00,https://scrapeme.live/shop/Clamperl/,"
Clamperl grows while being protected by its rock-hard shell. When its body becomes too large to fit inside the shell, it is sure evidence that this Pokémon is getting close to evolution.
",2967,"Categories: Bivalve, Pokemon","Tags: Bivalve, clamperl, Shell Armor",139 in stock
Huntail,£52.00,https://scrapeme.live/shop/Huntail/,"
Huntail’s tail is shaped like a fish. It uses the tail to attract prey, then swallows the prey whole with its large, gaping mouth. This Pokémon swims by wiggling its slender body like a snake.
",2805,"Categories: Deep Sea, Pokemon","Tags: Deep Sea, huntail, Swift Swim",54 in stock
Gorebyss,£150.00,https://scrapeme.live/shop/Gorebyss/,"
Although Gorebyss is the very picture of elegance and beauty while swimming, it is also cruel. When it spots prey, this Pokémon inserts its thin mouth into the prey’s body and drains the prey of its body fluids.
",9428,"Categories: Pokemon, South Sea","Tags: gorebyss, South Sea, Swift Swim",165 in stock
Relicanth,£157.00,https://scrapeme.live/shop/Relicanth/,"
Relicanth is a rare species that was discovered in deep-sea explorations. This Pokémon’s body withstands the enormous water pressure of the ocean depths. Its body is covered in tough scales that are like craggy rocks.
",7988,"Categories: Longevity, Pokemon","Tags: Longevity, relicanth, Rock Head",14 in stock
Luvdisc,£44.00,https://scrapeme.live/shop/Luvdisc/,"
Luvdisc’s heart-shaped body is a symbol of love and romance. It is said that any couple meeting this Pokémon is promised a loving relationship that never ends.
",4868,"Categories: Pokemon, Rendezvous","Tags: luvdisc, Rendezvous, Swift Swim",190 in stock
Bagon,£34.00,https://scrapeme.live/shop/Bagon/,"
Bagon harbors a never-ending dream of one day soaring high among the clouds. As if trying to dispel its frustration over its inability to fly, this Pokémon slams its hard head against huge rocks and shatters them into pebbles.
",3372,"Categories: Pokemon, Rock Head","Tags: bagon, Rock Head",232 in stock
Shelgon,£56.00,https://scrapeme.live/shop/Shelgon/,"
Covering Shelgon’s body are outgrowths much like bones. The shell is very hard and bounces off enemy attacks. When awaiting evolution, this Pokémon hides away in a cavern.
",1384,"Categories: Endurance, Pokemon","Tags: Endurance, Rock Head, shelgon",76 in stock
Salamence,£62.00,https://scrapeme.live/shop/Salamence/,"
By evolving into Salamence, this Pokémon finally realizes its long-held dream of growing wings. To express its joy, it flies and wheels all over the sky while spouting flames from its mouth.
",7686,"Categories: Dragon, Pokemon","Tags: Dragon, Intimidate, salamence",242 in stock
Beldum,£122.00,https://scrapeme.live/shop/Beldum/,"
Beldum keeps itself floating by generating a magnetic force that repels earth’s natural magnetism. When it sleeps, this Pokémon anchors itself to a cliff using the hooks on its rear.
",3484,"Categories: Iron Ball, Pokemon","Tags: beldum, Clear Body, Iron Ball",93 in stock
Metang,£78.00,https://scrapeme.live/shop/Metang/,"
When two Beldum fuse together, Metang is formed. The brains of the Beldum are joined by a magnetic nervous system. This Pokémon turns its arms to the rear for traveling at high speed.
",6906,"Categories: Iron Claw, Pokemon","Tags: Clear Body, Iron Claw, metang",227 in stock
Metagross,£170.00,https://scrapeme.live/shop/Metagross/,"
Metagross is the result of two Metang achieving fusion. When hunting, this Pokémon pins the prey to the ground under its massive body. It then eats the helpless victim using the large mouth on its stomach.
",8825,"Categories: Iron Leg, Pokemon","Tags: Clear Body, Iron Leg, metagross",177 in stock
Regirock,£66.00,https://scrapeme.live/shop/Regirock/,"
Regirock’s body is composed entirely of rocks. Recently, a study made the startling discovery that the rocks were all unearthed from different locations.
",5687,"Categories: Pokemon, Rock Peak","Tags: Clear Body, regirock, Rock Peak",65 in stock
Regice,£165.00,https://scrapeme.live/shop/Regice/,"
Regice cloaks itself with frigid air of -328 degrees Fahrenheit. Things will freeze solid just by going near this Pokémon. Its icy body is so cold, it will not melt even if it is immersed in magma.
",2261,"Categories: Iceberg, Pokemon","Tags: Clear Body, Iceberg, regice",107 in stock
Registeel,£196.00,https://scrapeme.live/shop/Registeel/,"
Registeel was imprisoned by people in ancient times. The metal composing its body is thought to be a curious substance that is not of this earth.
",6723,"Categories: Iron, Pokemon","Tags: Clear Body, Iron, registeel",67 in stock
Latias,£126.00,https://scrapeme.live/shop/Latias/,"
Latias is highly intelligent and capable of understanding human speech. It is covered with a glass-like down. The Pokémon enfolds its body with its down and refracts light to alter its appearance.
",5077,"Categories: Eon, Pokemon","Tags: Eon, latias, Levitate",245 in stock
Latios,£166.00,https://scrapeme.live/shop/Latios/,"
Latios will only open its heart to a Trainer with a compassionate spirit. This Pokémon can fly faster than a jet plane by folding its forelegs to minimize air resistance.
",7850,"Categories: Eon, Pokemon","Tags: Eon, latios, Levitate",197 in stock
Kyogre,£27.00,https://scrapeme.live/shop/Kyogre/,"
Kyogre is said to be the personification of the sea itself. Legends tell of its many clashes against Groudon, as each sought to gain the power of nature.
",5206,"Categories: Pokemon, Sea Basin","Tags: Drizzle, kyogre, Sea Basin",136 in stock
Groudon,£124.00,https://scrapeme.live/shop/Groudon/,"
Through Primal Reversion and with nature’s full power, it will take back its true form. It can cause magma to erupt and expand the landmass of the world.
",6626,"Categories: Continent, Pokemon","Tags: Continent, Drought, groudon",138 in stock
Rayquaza,£97.00,https://scrapeme.live/shop/Rayquaza/,"
It flies forever through the ozone layer, consuming meteoroids for sustenance. The many meteoroids in its body provide the energy it needs to Mega Evolve.
",5410,"Categories: Pokemon, Sky High","Tags: Air Lock, rayquaza, Sky High",31 in stock
Jirachi,£111.00,https://scrapeme.live/shop/Jirachi/,"
Jirachi will awaken from its sleep of a thousand years if you sing to it in a voice of purity. It is said to make true any wish that people desire.
",7952,"Categories: Pokemon, Wish","Tags: jirachi, Serene Grace, Wish",294 in stock
Turtwig,£101.00,https://scrapeme.live/shop/Turtwig/,"
It undertakes photosynthesis with its body, making oxygen. The leaf on its head wilts if it is thirsty.
",8788,"Categories: Pokemon, Tiny Leaf","Tags: Overgrow, Tiny Leaf, turtwig",254 in stock
Grotle,£154.00,https://scrapeme.live/shop/Grotle/,"
It knows where pure water wells up. It carries fellow Pokémon there on its back.
",7359,"Categories: Grove, Pokemon","Tags: grotle, Grove, Overgrow",187 in stock
Torterra,£87.00,https://scrapeme.live/shop/Torterra/,"
Small Pokémon occasionally gather on its unmoving back to begin building their nests.
",8373,"Categories: Continent, Pokemon","Tags: Continent, Overgrow, torterra",146 in stock
Chimchar,£143.00,https://scrapeme.live/shop/Chimchar/,"
The gas made in its belly burns from its rear end. The fire burns weakly when it feels sick.
",5021,"Categories: Chimp, Pokemon","Tags: Blaze, chimchar, Chimp",242 in stock
Monferno,£68.00,https://scrapeme.live/shop/Monferno/,"
It uses ceilings and walls to launch aerial attacks. Its fiery tail is but one weapon.
",8413,"Categories: Playful, Pokemon","Tags: Blaze, monferno, Playful",299 in stock
Infernape,£165.00,https://scrapeme.live/shop/Infernape/,"
It tosses its enemies around with agility. It uses all its limbs to fight in its own unique style.
",3225,"Categories: Flame, Pokemon","Tags: Blaze, Flame, infernape",82 in stock
Prinplup,£177.00,https://scrapeme.live/shop/Prinplup/,"
It lives a solitary life. Its wings deliver wicked blows that can snap even the thickest of trees.
",5785,"Categories: Penguin, Pokemon","Tags: Penguin, prinplup, Torrent",52 in stock
Empoleon,£42.00,https://scrapeme.live/shop/Empoleon/,"
The three horns that extend from its beak attest to its power. The leader has the biggest horns.
",2449,"Categories: Emperor, Pokemon","Tags: Emperor, empoleon, Torrent",232 in stock
Starly,£59.00,https://scrapeme.live/shop/Starly/,"
They flock around mountains and fields, chasing after bug Pokémon. Their singing is noisy and annoying.
",3055,"Categories: Pokemon, Starling","Tags: Keen Eye, Starling, starly",110 in stock
Staravia,£158.00,https://scrapeme.live/shop/Staravia/,"
It lives in forests and fields. Squabbles over territory occur when flocks collide.
",1799,"Categories: Pokemon, Starling","Tags: Intimidate, staravia, Starling",263 in stock
Staraptor,£42.00,https://scrapeme.live/shop/Staraptor/,"
When Staravia evolve into Staraptor, they leave the flock to live alone. They have sturdy wings.
",9866,"Categories: Pokemon, Predator","Tags: Intimidate, Predator, staraptor",131 in stock
Bidoof,£128.00,https://scrapeme.live/shop/Bidoof/,"
It constantly gnaws on logs and rocks to whittle down its front teeth. It nests alongside water.
",1171,"Categories: Plump Mouse, Pokemon","Tags: bidoof, Plump Mouse, Simple",264 in stock
Bibarel,£114.00,https://scrapeme.live/shop/Bibarel/,"
It makes its nest by damming streams with bark and mud. It is known as an industrious worker.
",6844,"Categories: Beaver, Pokemon","Tags: Beaver, bibarel, Simple",156 in stock
Kricketot,£94.00,https://scrapeme.live/shop/Kricketot/,"
When its antennae hit each other, it sounds like the music of a xylophone.
",9812,"Categories: Cricket, Pokemon","Tags: Cricket, kricketot, Shed Skin",137 in stock
Kricketune,£53.00,https://scrapeme.live/shop/Kricketune/,"
It signals its emotions with its melodies. Scientists are studying these melodic patterns.
",8726,"Categories: Cricket, Pokemon","Tags: Cricket, kricketune, Swarm",186 in stock
Shinx,£149.00,https://scrapeme.live/shop/Shinx/,"
All of its fur dazzles if danger is sensed. It flees while the foe is momentarily blinded.
",1507,"Categories: Flash, Pokemon","Tags: Flash, Intimidate, shinx",295 in stock
Luxio,£168.00,https://scrapeme.live/shop/Luxio/,"
Strong electricity courses through the tips of its sharp claws. A light scratch causes fainting in foes.
",9734,"Categories: Pokemon, Spark","Tags: Intimidate, luxio, Spark",222 in stock
Luxray,£43.00,https://scrapeme.live/shop/Luxray/,"
Luxray’s ability to see through objects comes in handy when it’s scouting for danger.
",4317,"Categories: Gleam Eyes, Pokemon","Tags: Gleam Eyes, Intimidate, luxray",227 in stock
Budew,£171.00,https://scrapeme.live/shop/Budew/,"
Over the winter, it closes its bud and endures the cold. In spring, the bud opens and releases pollen.
",3438,"Categories: Bud, Pokemon","Tags: Bud, budew, Poison Point",62 in stock
Roserade,£155.00,https://scrapeme.live/shop/Roserade/,"
With the movements of a dancer, it strikes with whips that are densely lined with poison thorns.
",7696,"Categories: Bouquet, Pokemon","Tags: Bouquet, Poison Point, roserade",116 in stock
Cranidos,£47.00,https://scrapeme.live/shop/Cranidos/,"
A lifelong jungle dweller from 100 million years ago, it would snap obstructing trees with headbutts.
",8627,"Categories: Head Butt, Pokemon","Tags: cranidos, Head Butt, Mold Breaker",98 in stock
Rampardos,£196.00,https://scrapeme.live/shop/Rampardos/,"
Its skull is as hard as iron. It is a brute that tears down jungle trees while catching prey.
",3536,"Categories: Head Butt, Pokemon","Tags: Head Butt, Mold Breaker, rampardos",91 in stock
Shieldon,£42.00,https://scrapeme.live/shop/Shieldon/,"
It was generated from a fossil dug out of a layer of clay that was older than anyone knows. It has a sturdy face.
",9942,"Categories: Pokemon, Shield","Tags: Shield, shieldon, Sturdy",284 in stock
Bastiodon,£191.00,https://scrapeme.live/shop/Bastiodon/,"
Any frontal attack is repulsed. It is a docile Pokémon that feeds on grass and berries.
",6537,"Categories: Pokemon, Shield","Tags: bastiodon, Shield, Sturdy",14 in stock
